date,title,selftext,is_self,upvotes,upvote_ratio,n_comments,permalink,author
2021-06-07 17:06:00,How to migrate from Slack to Zoom Chat,"Mio Engineering Director, Ed James, has laid out instructions on [how to export all your Slack data and import to Zoom Chat](https://dispatch.m.io/migrate-from-slack-to-zoom-chat/).

Ideal for Slack customers who started using Zoom for video calls during the pandemic - and find themselves wanting to use Zoom's chat functionality so they can remain in one app instead of switching back and forth.",1.0,1.0,1.0,4.0,/r/Zoom/comments/nu7xi1/how_to_migrate_from_slack_to_zoom_chat/,DominicMio
2021-06-07 18:58:23,"Leveraging Zoom’s Video SDK for Your Business - Video communication creates endless possibilities. Be it customer engagement or team collaboration, video conferencing solutions can be used in innumerable scenarios. Real-time communication can be added to a business setup for better communication.",,0.0,1.0,1.0,2.0,/r/Zoom/comments/nu9kkg/leveraging_zooms_video_sdk_for_your_business/,rtcwebusa
2021-06-07 19:23:36,I need help in understanding cloud meeintgs,"Can i ask?  
After the cloud file is saved, who gets to keep the file? The Host? Can the Co-Host get a copy of the file? Thanks",1.0,1.0,1.0,5.0,/r/Zoom/comments/nu9zth/i_need_help_in_understanding_cloud_meeintgs/,Jenkyrs
2021-06-07 21:42:31,troll this meeting please https://meet.google.com/epu-bhaz-zmi?hs=224,[removed],1.0,1.0,1.0,0.0,/r/Zoom/comments/nucuoj/troll_this_meeting_please/,ResponsibilityNo4367
2021-06-08 01:34:08,Zoom is taking a very long time to respond to any inputs. Any idea what’s going wrong/how to fix it?,,0.0,1.0,1.0,6.0,/r/Zoom/comments/nuid1k/zoom_is_taking_a_very_long_time_to_respond_to_any/,Various-Vegetable-10
2021-06-08 02:38:22,List of participants,"Hi there,

We held a meeting via Zoom and it was not a paid subscription. We want the list of participants but learnt now that only paid subscribers can obtain a list of participants. 

So the question is-even if we upgrade our subscription to paid, will we be able to get a list of participants for the past meeting which has already happened when we were using the free version? Thx",1.0,1.0,1.0,2.0,/r/Zoom/comments/nujwvo/list_of_participants/,codebeanjava8
2021-06-08 03:08:12,"When clicking 'Join' in Zoom Client, nothing happens?","No error message, no nothing. Yes, I uninstalled, reinstalled, and checked for updates.

On a sidenote, I also can't seem to turn my camera on in the client, and have been getting an error message saying that another application is using my camera. Literally nothing else is running on my laptop (quit everything in Task Manager) so I haven't a clue what's up with that... 

TIA for any help.",1.0,1.0,1.0,3.0,/r/Zoom/comments/nukmuz/when_clicking_join_in_zoom_client_nothing_happens/,exhaustedwerewolf
2021-06-08 04:55:44,Aspect ratio while on iphone - how do I get to 16:9?,"I'm doing tests for recording a zoom interview for a documentary. My iPhone is defaulting to a 4:3 aspect ratio rather than 16:9. I have changed the aspect ratio to ""scale to fit"" from ""original ratio"", which is supposed to sort it, but it hasn't. Still 4:3. I quit out of zoom and restarted and still it's 4:3. Any ideas on how to solve this?",1.0,1.0,1.0,7.0,/r/Zoom/comments/nuncaf/aspect_ratio_while_on_iphone_how_do_i_get_to_169/,Tortoiseshell007
2021-06-08 05:07:02,I am trying to do too much?,"I would like to share screen to show a video as well as screen mirroring to a TV monitor at the same time using an iPad.
This is for a meeting with participants in person and others on Zoom. I did a chat with a Zoom rep who said it wasnt possible. But, she did not seem engaged or knowledgable.",1.0,1.0,1.0,8.0,/r/Zoom/comments/nunm6e/i_am_trying_to_do_too_much/,williagh
2021-06-08 05:31:00,Control Pulpit Mic Mute/Unmute remotely?,"We have been having Zoom-only church services for over 14 months. But we recently turned to in-person and Zoom HYBRID services. In our services, there are many different, individual participants, both local and online. However, we have learned very well how to manage the Mute/Unmute process for online participants, we are very, very happy with that. But, in our 'local' (In-Person) participants, we have a few microphones (we use old, or in-service, iPhones and Androids) where we log in to Zoom with video-only or audio-only.

We are actually doing wonderful with our array of cameras, but we are NOT comfortable with how our phones used as Mics are Muted/Unmuted. Our pulpit phone, for instance, is used by 4 people on a Sunday and some do and some do not need to unmute. These are not the same people, and we realize people are trainable, but we want our services to go absolutely seamlessly.  So, ...

It would be a great help if there was a way for our host (and Co-Hosts) to manage the mute and unmute functions from our control panel. The same as other Zoom users over the Covid days, we really enjoyed the pre-Covid defaults!

TIA",1.0,1.0,1.0,8.0,/r/Zoom/comments/nuo6bd/control_pulpit_mic_muteunmute_remotely/,jimbo78255
2021-06-08 08:24:09,"Limit on number of participants inside a Zoom break-out room? From this image, I am not sure if it’s 200 per room or 200 total...",,0.0,1.0,1.0,2.0,/r/Zoom/comments/nursrb/limit_on_number_of_participants_inside_a_zoom/,Gemini-giraffe
2021-06-08 08:47:33,why is there a green border around my screen when i'm muted?,is it possible that zoom randomly creates this when someone leaves the zoom room?,1.0,1.0,1.0,8.0,/r/Zoom/comments/nus8ig/why_is_there_a_green_border_around_my_screen_when/,aggravatedduckk
2021-06-08 11:04:09,lichess video,"
与“lichess videos”相符的视频搜索结果10:13
Top 10 Chess Openings • Free Chess Videos • lichess.org",1.0,1.0,1.0,2.0,/r/Zoom/comments/nuusxy/lichess_video/,Khorhensey11
2021-06-08 11:21:06,Does anyone have an old installer for Linux (.deb as I am in Debian 10 buster),"Recently zoom released a broken update on the snap store. It works for a little while after which I have to reinstall it to work.

As of now, all the installation channels on snap provide the same version of zoom.

If anyone has an installer for the older version of zoom please provide the link as I am in serious need of it.",1.0,1.0,1.0,8.0,/r/Zoom/comments/nuv46l/does_anyone_have_an_old_installer_for_linux_deb/,Koshin_S_Hegde
2021-06-08 13:58:04,Apple announced major FaceTime upgrades at WWDC that will make it more like Zoom,[removed],1.0,1.0,1.0,2.0,/r/Zoom/comments/nuxptn/apple_announced_major_facetime_upgrades_at_wwdc/,Ibrahim062222
2021-06-08 14:24:24,Official Zoom Reddit Discord - come and join!!,[removed],1.0,1.0,1.0,0.0,/r/Zoom/comments/nuy3wu/official_zoom_reddit_discord_come_and_join/,Tintovic
2021-06-08 17:02:08,How to download &amp; Install ZOOM US App| How to Setup Zoom Us for use.,,0.0,1.0,1.0,2.0,/r/Zoom/comments/nv0ehf/how_to_download_install_zoom_us_app_how_to_setup/,hzrtyr
2021-06-08 18:50:39,Zoom micro after paused meeting (iOS),[removed],1.0,1.0,1.0,2.0,/r/Zoom/comments/nv1a3s/zoom_micro_after_paused_meeting_ios/,phenix1
2021-06-08 20:00:02,PowerPoint audio not audible to other participants,"Hi everyone, I have to do a PowerPoint presentation which contains some videos, but while trying it today with a friend of mine it was told me he didn't hear anything from them. I activated both ""share audio"" and ""optimize for videoclips"", but without any results. What else can I try to fix this issue?",1.0,1.0,1.0,6.0,/r/Zoom/comments/nv2ezx/powerpoint_audio_not_audible_to_other_participants/,Dapper-Ordinary5555
2021-06-08 21:10:34,Zoom audio stops abruptly,[removed],1.0,1.0,1.0,2.0,/r/Zoom/comments/nv3ois/zoom_audio_stops_abruptly/,keizmi
2021-06-08 21:41:51,WHY does Zoom call me basic when am a pro?,[removed],1.0,1.0,1.0,2.0,/r/Zoom/comments/nv4ake/why_does_zoom_call_me_basic_when_am_a_pro/,dkkchoice
2021-06-08 22:01:48,Please for the love of god let chimes be disabled by for individual participants,[removed],1.0,1.0,1.0,2.0,/r/Zoom/comments/nv4pof/please_for_the_love_of_god_let_chimes_be_disabled/,FloridAsh
2021-06-08 22:27:21,Missing ‘hosted meetings’ under usage reports tab,[removed],1.0,1.0,1.0,2.0,/r/Zoom/comments/nv5a8h/missing_hosted_meetings_under_usage_reports_tab/,fuckthebedbugs
2021-06-09 00:54:02,Zoom Account,[removed],1.0,1.0,1.0,2.0,/r/Zoom/comments/nv8qc4/zoom_account/,tappegamer69
2021-06-09 01:22:00,Why does Zoom not see my Pro account,[removed],1.0,1.0,1.0,2.0,/r/Zoom/comments/nv9dbz/why_does_zoom_not_see_my_pro_account/,dkkchoice
2021-06-09 05:55:52,VB HiFi cable down pitches my audio output a whole step,[removed],1.0,1.0,1.0,2.0,/r/Zoom/comments/nvfoq9/vb_hifi_cable_down_pitches_my_audio_output_a/,beckarus
2021-06-09 07:08:04,Are we able to take remote control of other people's screens anymore? Cannot find the option anywhere.,[removed],1.0,1.0,1.0,0.0,/r/Zoom/comments/nvha64/are_we_able_to_take_remote_control_of_other/,petrucci666
2021-06-09 08:11:26,Presenters screen went blank,[removed],1.0,1.0,1.0,2.0,/r/Zoom/comments/nvikbx/presenters_screen_went_blank/,ejskippy
2021-06-09 13:03:02,"Zoom throttling my PC, weird GPU usage pattern",[removed],1.0,1.0,1.0,2.0,/r/Zoom/comments/nvnqwr/zoom_throttling_my_pc_weird_gpu_usage_pattern/,Zyvoxx
2021-06-09 13:37:48,Zoom while we fuck! COUPLES,[removed],1.0,1.0,1.0,2.0,/r/Zoom/comments/nvoaeb/zoom_while_we_fuck_couples/,yourfavcpl361
2021-06-09 14:13:41,Can owner of recording track that the recording has been downloaded by someone?,[removed],1.0,1.0,1.0,2.0,/r/Zoom/comments/nvou1j/can_owner_of_recording_track_that_the_recording/,hacktiviste
2021-06-09 17:36:37,"I’m trying to set up a call for 350 people with break-outs, and it is not clear to me whether these numbers on the right column (200/500/400) are the number of people PER ROOM or TOTAL IN THE CALL. Anyone? I’ve reached out to Zoom support but didn’t get a helpful response",,0.0,1.0,1.0,2.0,/r/Zoom/comments/nvrqru/im_trying_to_set_up_a_call_for_350_people_with/,Gemini-giraffe
2021-06-09 17:37:50,"I’m trying to set up a call for 350 people with break-outs, and it is not clear to me whether these numbers on the right column (200/500/400) are the number of people PER ROOM or TOTAL IN THE CALL. Anyone? I’ve reached out to Zoom support but didn’t get a helpful response",,0.0,1.0,1.0,2.0,/r/Zoom/comments/nvrrfw/im_trying_to_set_up_a_call_for_350_people_with/,Gemini-giraffe
2021-06-09 19:01:46,Can a Zoom admin/host see which device I’m using?,[removed],1.0,1.0,1.0,2.0,/r/Zoom/comments/nvt2dy/can_a_zoom_adminhost_see_which_device_im_using/,demonology26
2021-06-09 19:48:29,ZOOM breakout rooms and translation,"The only way to translate for people in breakout rooms on ZOOM is to leave them on floor. Breakout rooms will be for those who understand the foreign language, and the floor for those who don't. I hope I was of help.",1.0,1.0,1.0,2.0,/r/Zoom/comments/nvtueh/zoom_breakout_rooms_and_translation/,Salty-Elephant2215
2021-06-09 21:00:39,Remote Video Capturing with Windows VM,,0.0,1.0,1.0,8.0,/r/Zoom/comments/nvvdm1/remote_video_capturing_with_windows_vm/,Ricupuch
2021-06-09 21:07:06,Zoom audio lagging horribly despite good internet connection,[removed],1.0,1.0,1.0,0.0,/r/Zoom/comments/nvvikc/zoom_audio_lagging_horribly_despite_good_internet/,soap_muncher
2021-06-09 22:16:25,Microphone not working without the Original Sound Enabled,"Hello! I'm ""fixing"" My aunt's tablet cuz her microphone wasn't working.

I figures out that it only works with the Original Sound Enabled. 
But I'm sure that my aunt, with her hands shaking won't be able to turn it on everytime.

Is it tablet's fault (Samsung Galaxy Tab A), or update's fault or maybe some hidden settings.",1.0,1.0,1.0,2.0,/r/Zoom/comments/nvwznh/microphone_not_working_without_the_original_sound/,1Dad_Is_Proud1
2021-06-09 22:22:26,I soft-locked myself from deleting my Zoom account. How do I fix this?,"I made a Zoom account by selecting sign-in with google and selecting my school email since I didn't want to use my personal email. I'm starting to regret it.

Now that I'm done with the school year, I want to delete my Zoom account. But in order to do that, I need to submit a verification code that they send to my email that I used to sign up with. I can't do that because the student email I used is managed by my school and doesn't allow emails outside of school to be received. Meaning that all the Zoom support emails don't even show up, not in spam or trash or in all mail, it simply isn't there.

I've tried contacting my school to see if they could just allow the no-reply@Zoom email to be allowed, but they're not willing to do that. 

I've tried to change the email to my personal one so I could receive the support emails, but it requires the password for my account to do so, which I have forgotten.

I've tried to change the password for my account, but it just sends the email to my school email which doesn't even show up as stated above.

The only way I could ever see this being solved is if I could just have someone at Zoom to either manually delete my account, or to email my personal email with the password so that I could at least delete it myself. However, I doubt that would happen. Does anyone have any suggestions to what I should do?

Other information: 

* I don't have the Zoom app, I just use the online web version. 
* My account is a basic one, I should be able to delete my account without providing a code according to the Zoom support page for terminating an account.",1.0,1.0,1.0,6.0,/r/Zoom/comments/nvx4dg/i_softlocked_myself_from_deleting_my_zoom_account/,Throwaway_1437
2021-06-09 23:14:00,Mute on/off notification,[removed],1.0,1.0,1.0,2.0,/r/Zoom/comments/nvy9mn/mute_onoff_notification/,wholesomeguy555
2021-06-10 00:10:33,Delete,Can you delete a private message guys in the zoom meeting not chat?,1.0,1.0,1.0,3.0,/r/Zoom/comments/nvzk7m/delete/,Ok-Character2746
2021-06-10 00:44:26,Is there absolutely ANY way I can share a PowerPoint AND show my face on Zoom Mobile?,[removed],1.0,1.0,1.0,2.0,/r/Zoom/comments/nw0cd4/is_there_absolutely_any_way_i_can_share_a/,YoItsMCat
2021-06-10 02:27:27,Zoom won't even launch??? Help,[removed],1.0,1.0,1.0,2.0,/r/Zoom/comments/nw2q90/zoom_wont_even_launch_help/,DangerousPooper15
2021-06-10 03:08:33,Randomly unable to use virtual background w/o green screen,[removed],1.0,1.0,1.0,2.0,/r/Zoom/comments/nw3ohf/randomly_unable_to_use_virtual_background_wo/,DyingEcho
2021-06-10 05:14:55,What to do plz reply fast im annoyed,[removed],1.0,1.0,1.0,2.0,/r/Zoom/comments/nw6jyt/what_to_do_plz_reply_fast_im_annoyed/,8799Joe8799
2021-06-10 05:46:34,Auto Ending Zoom Meetings,[removed],1.0,1.0,1.0,2.0,/r/Zoom/comments/nw7978/auto_ending_zoom_meetings/,2doodlemomma
2021-06-10 06:58:19,I have a zoomgov account but I never made one…,[removed],1.0,1.0,1.0,2.0,/r/Zoom/comments/nw8rnk/i_have_a_zoomgov_account_but_i_never_made_one/,imth2poopoopeepeeman
2021-06-10 07:52:15,Any way to Zoom from an iPhone better than 360p?,[removed],1.0,1.0,1.0,2.0,/r/Zoom/comments/nw9u03/any_way_to_zoom_from_an_iphone_better_than_360p/,bombadil1564
2021-06-10 08:25:33,"Zoom had a 2,091.94% increase (the largest overall) in traffic during the pandemic",,0.0,1.0,1.0,3.0,/r/Zoom/comments/nwah60/zoom_had_a_209194_increase_the_largest_overall_in/,alicedoesstuff
2021-06-10 09:09:17,JOIN,,0.0,1.0,1.0,2.0,/r/Zoom/comments/nwbby5/join/,Narrow-Driver-7887
2021-06-10 09:53:47,"Zoom no longer prompts for RTSP URL, Stream Key, etc. (Custom)",[removed],1.0,1.0,1.0,2.0,/r/Zoom/comments/nwc6cq/zoom_no_longer_prompts_for_rtsp_url_stream_key/,ultramagnus_tcv
2021-06-10 10:25:27,Webinar - Alternative host can’t join,[removed],1.0,1.0,1.0,2.0,/r/Zoom/comments/nwcsa0/webinar_alternative_host_cant_join/,aflynn5
2021-06-10 15:20:58,How to Reduce Background Noise in Zoom,,0.0,1.0,1.0,2.0,/r/Zoom/comments/nwhlad/how_to_reduce_background_noise_in_zoom/,Zestyclose_Jicama_19
2021-06-10 15:30:35,The Funded Project Memorial Day Special with Doug Bowmer - Feeding The Needy in Anderson,,0.0,1.0,1.0,2.0,/r/Zoom/comments/nwhq6x/the_funded_project_memorial_day_special_with_doug/,Unlikely_Patience371
2021-06-10 16:44:21,Extremely poor performance with good internet,[removed],1.0,1.0,1.0,0.0,/r/Zoom/comments/nwir9u/extremely_poor_performance_with_good_internet/,icantfindsth
2021-06-10 21:16:25,"I turned the camera on and this comes up, any help?",,0.0,1.0,0.99,8.0,/r/Zoom/comments/nwnefv/i_turned_the_camera_on_and_this_comes_up_any_help/,OnePoint135_
2021-06-10 21:17:38,End of meeting interruption,[removed],1.0,1.0,1.0,2.0,/r/Zoom/comments/nwnfer/end_of_meeting_interruption/,Sgtpepper672
2021-06-10 21:45:19,Zoom meetings,[removed],1.0,1.0,1.0,2.0,/r/Zoom/comments/nwo15u/zoom_meetings/,tappegamer69
2021-06-10 22:55:47,Zoom vs. Google Meet?,[removed],1.0,1.0,1.0,2.0,/r/Zoom/comments/nwpmqj/zoom_vs_google_meet/,ahmedontia
2021-06-11 01:45:04,"If I take a screenshot of ongoing meeting with my mic on, will the other people in meeting hear or know?",[removed],1.0,1.0,1.0,2.0,/r/Zoom/comments/nwtp34/if_i_take_a_screenshot_of_ongoing_meeting_with_my/,kadjenner
2021-06-11 02:26:59,Robot that attends my Online Classes - It even TALKS to teachers!,,0.0,1.0,1.0,2.0,/r/Zoom/comments/nwupha/robot_that_attends_my_online_classes_it_even/,MyWorldRules
2021-06-11 03:30:59,Can my employer see interview calls on my account?,[removed],1.0,1.0,1.0,2.0,/r/Zoom/comments/nww9a3/can_my_employer_see_interview_calls_on_my_account/,vmflair
2021-06-11 06:28:58,Waiting Room Messages,[removed],1.0,1.0,1.0,2.0,/r/Zoom/comments/nx0exr/waiting_room_messages/,Draphiaro
2021-06-11 06:35:55,"How to fix mic delay (webcam audio sync) problem in Zoom, on a Mac",,0.0,2.0,0.75,3.0,/r/Zoom/comments/nx0km6/how_to_fix_mic_delay_webcam_audio_sync_problem_in/,spankymustard
2021-06-11 07:04:48,Resolution and File Size of Zoom Recordings,[removed],1.0,1.0,1.0,2.0,/r/Zoom/comments/nx16mf/resolution_and_file_size_of_zoom_recordings/,1TonSoupp
2021-06-11 07:17:16,Lower Resolution to Optimize Download Time!,NA,1.0,1.0,1.0,2.0,/r/Zoom/comments/nx1fzk/lower_resolution_to_optimize_download_time/,[deleted]
2021-06-11 07:27:59,Lower Resolution to Optimize Download Time,[removed],1.0,1.0,1.0,2.0,/r/Zoom/comments/nx1nsn/lower_resolution_to_optimize_download_time/,1TonSoupp
2021-06-11 07:52:25,Waiting room issues.,"When I enable the waiting room, am I the only person who can get into the meeting and start letting people in? I have a daily meeting with different people being in charge each day and am trying to make it so I don't have to be there to make one of them host every time. 

I thought I could give my host's, the host key, and they will be able to get on using the key and manage the meeting. This is not the case. They are stuck outside waiting for me to start the meeting. Any way to group my trusted people and have them as admin/host so they can start the meeting without me and still be able to utilize the waiting room??",1.0,1.0,1.0,4.0,/r/Zoom/comments/nx25iq/waiting_room_issues/,Groundbreaking-Pop17
2021-06-11 08:02:33,Resetting 2FA on a personal account,[removed],1.0,1.0,1.0,0.0,/r/Zoom/comments/nx2d0h/resetting_2fa_on_a_personal_account/,hengbokdl7
2021-06-11 09:39:44,From Zoom through OBS to elsewhere,[removed],1.0,1.0,1.0,2.0,/r/Zoom/comments/nx48mj/from_zoom_through_obs_to_elsewhere/,ultramagnus_tcv
2021-06-11 10:08:16,Merging separate meetings into one meeting.,[removed],1.0,1.0,1.0,2.0,/r/Zoom/comments/nx4r9e/merging_separate_meetings_into_one_meeting/,sbutj323
2021-06-11 11:17:35,Cloud Transcription Formatting Help,[removed],1.0,1.0,1.0,2.0,/r/Zoom/comments/nx60u5/cloud_transcription_formatting_help/,TerriblePop
2021-06-11 12:51:29,Can someone help me with using Zoom whiteboard?,[removed],1.0,1.0,0.99,2.0,/r/Zoom/comments/nx7nvf/can_someone_help_me_with_using_zoom_whiteboard/,Apprehensive-Soup311
2021-06-11 14:09:56,My batch party zoom chat,[removed],1.0,1.0,1.0,0.0,/r/Zoom/comments/nx8xkh/my_batch_party_zoom_chat/,Wonderful_District35
2021-06-11 15:52:24,laptop and iPad set up for teaching,[removed],1.0,1.0,1.0,2.0,/r/Zoom/comments/nxaf95/laptop_and_ipad_set_up_for_teaching/,Cookiemonsterpsy
2021-06-11 16:39:58,Error 1132 - Won't Sign In or Let Me Join a Meeting,"I use Zoom for online classes, and it was working like a charm on my personal computer. But, a few days ago, I had to use a different PC due to personal reasons. It didn't have Zoom, so I installed the latest version from the website and proceeded to sign into my existing account, and that is when it showed me the ""Failed To Sign In. Error 1132"" error dialogue. I tried joining my classes without signing in too, but the same error appeared, this time with a different dialogue; ""Unknown error. Error 1132"". I tried logging in and joining for many days, and just doesn't budge. I tried Zoom Browser, but it is just plain pathetic. Too much of audio and video lag, it also just freezes half way through a meeting. I desperately need a solution for this. My account IS NOT BLACKLISTED. It works on mobile phones without any issue, but I need it to work on this PC. Here are the specs if that would help:  
\--&gt; AMD A4 PRO  
\--&gt; 4GB RAM  
\--&gt; Windows 10 for Education",1.0,1.0,1.0,7.0,/r/Zoom/comments/nxb4hi/error_1132_wont_sign_in_or_let_me_join_a_meeting/,SparkySyndicate
2021-06-11 21:22:18,"Trying to turn on my camera and this comes up, I never had this problem, what could be causing it? (There is only one camera to select)",,0.0,1.0,1.0,8.0,/r/Zoom/comments/nxfv7q/trying_to_turn_on_my_camera_and_this_comes_up_i/,MacriKilledNisman
2021-06-11 22:05:49,How does Zoom know my gmail address?,[removed],1.0,1.0,1.0,2.0,/r/Zoom/comments/nxgs2k/how_does_zoom_know_my_gmail_address/,Posiment
2021-06-11 22:25:10,"Markets: Zoom, Salesforce Invest In Monday.com's IPO",,0.0,1.0,1.0,3.0,/r/Zoom/comments/nxh762/markets_zoom_salesforce_invest_in_mondaycoms_ipo/,The-Techie
2021-06-12 01:53:06,"Recorded 3 Presentation onto the Cloud, and they came out at different resolutions.",[removed],1.0,1.0,1.0,2.0,/r/Zoom/comments/nxm09t/recorded_3_presentation_onto_the_cloud_and_they/,1TonSoupp
2021-06-12 04:36:58,If you believe Zoom recording you should be opt-in give an up arrow,[removed],1.0,1.0,1.0,3.0,/r/Zoom/comments/nxplfg/if_you_believe_zoom_recording_you_should_be_optin/,quantumfive
2021-06-12 05:39:36,Zoom Webinar Licenses Automatically Being Upgraded for No Additional Cost?,[removed],1.0,1.0,1.0,2.0,/r/Zoom/comments/nxqz7g/zoom_webinar_licenses_automatically_being/,gioraffe32
2021-06-12 06:43:14,Can Zoom host see ur screen without ur permission?,lol,1.0,1.0,1.0,2.0,/r/Zoom/comments/nxsb4o/can_zoom_host_see_ur_screen_without_ur_permission/,Long_Cauliflower5016
2021-06-12 07:32:28,"I wrote a webcam background replacement tool for Linux. It works with Zoom, it does not need a GPU or a green screen.",,0.0,1.0,1.0,4.0,/r/Zoom/comments/nxt8ji/i_wrote_a_webcam_background_replacement_tool_for/,fufufang
2021-06-12 07:58:26,https://gkrkarate.zoom.us/my/gkr54607,bomb,1.0,1.0,1.0,2.0,/r/Zoom/comments/nxtq54/httpsgkrkaratezoomusmygkr54607/,YeetMemezz
2021-06-12 08:17:09,How to report someone,"Someone exposed themselves on a meeting today. How do we go about reporting this person and what will happen to them.  Will they face legal charges, get banned from zoom?",1.0,1.0,1.0,5.0,/r/Zoom/comments/nxu383/how_to_report_someone/,Extreme_Art_9286
2021-06-12 10:21:24,"Help: Sony Alpha a6000 webcam - Preview is great, output image is poor. Totally stumped!",[removed],1.0,1.0,1.0,2.0,/r/Zoom/comments/nxwatu/help_sony_alpha_a6000_webcam_preview_is_great/,InflatableFun
2021-06-12 14:15:20,Can my school administration see all my zoom meetings? Even ones hosted by myself but outside of class?,"I’ve seen a similar post to this one but the answers contradicted each other. Just to clarify, I am asking if while using my school account to host a meeting on zoom, can my school see when I’m using zoom and who is in the meeting?",1.0,1.0,1.0,4.0,/r/Zoom/comments/ny05lo/can_my_school_administration_see_all_my_zoom/,vanillabean19
2021-06-12 18:24:26,Zoom On 2 Monitors,"I want to run Zoom on a dual monitor setup and im looking for a laptop that can do that. The minimum requirements presented on the site are the following:

* CPU: i5+ Quad Core (or higher) | i5+ Duo Core (or higher) 2GHz+
* RAM: 4GB+

Can i run Zoom on 2 monitors with the following or should i look for a better option?:

*  Intel Core i3 1115G4 3.0 GHz
* 4 GB DDR4",1.0,1.0,1.0,2.0,/r/Zoom/comments/ny3oyl/zoom_on_2_monitors/,AggelosLOL
2021-06-12 18:30:37,Zoom hanging when selecting 'view' on linux client,[removed],1.0,1.0,1.0,2.0,/r/Zoom/comments/ny3s49/zoom_hanging_when_selecting_view_on_linux_client/,dm319
2021-06-12 19:46:21,Will assigning someone else to be the Host affect FB Live?,"Hai I'm new to Zoom and have little knowledge about tech stuff. So bear with me.

So my friend is the host of this Zoom meeting and she stream the meeting on FB Live. During the meeting, she need to attend an emergency and wanted to give the host privilege to someone else. But the concern is, if she give the host privilege to others, will it affect FB Live? If it does do that, what are the affected things?",1.0,1.0,1.0,3.0,/r/Zoom/comments/ny4yqy/will_assigning_someone_else_to_be_the_host_affect/,LtSiccor
2021-06-12 20:47:39,This is why you should move your business to Anderson Indiana,,0.0,1.0,1.0,2.0,/r/Zoom/comments/ny5zlg/this_is_why_you_should_move_your_business_to/,Long-Method1644
2021-06-13 01:04:41,Setting Default Browser,Is there a way to change the default browser that Zoom uses to open links in chat? Currently all links open Internet Explorer and I want them to open in Chrome.,1.0,1.0,1.0,5.0,/r/Zoom/comments/nyba7w/setting_default_browser/,adamhathaway
