date,title,selftext,is_self,upvotes,upvote_ratio,n_comments,permalink,author
2021-08-20 11:36:27,Using Zoom Dual Screen with an ultrawide and Displayfusion,"When i had 3 physical screens, I could use the 'dual screen' function in zoom to have the speaker view + participants box on my left screen, and the gallery view on the center screen.  Now I am working with a single wide display, and I use displayfusion to split it into virtual screens.  How can i get Zoom to see the virtual screens and so do the dual screen split again? That view really worked well for me.",1.0,1.0,1.0,3.0,/r/Zoom/comments/p7u9re/using_zoom_dual_screen_with_an_ultrawide_and/,vorpal-blade
2021-08-20 11:48:22,help plz,"So I have seen these people using their cameras on laptop but having it set so its a video playing, not what their actual camera is showing, and i was wondering if anyone knows how to do it with something like external software 

my laptop won't let me use a video background so i was wondering if there is a way that I can do this with software or somethin",1.0,1.0,1.0,5.0,/r/Zoom/comments/p7ug8a/help_plz/,Captain_Stick
2021-08-20 11:51:35,If I’m dialling into a zoom call can I use the mute mic feature on my phone to mute myself or do I have to use the zoom mute?,"Talking about being able to use the actual mute mic button that comes up whenever you call someone, does it work the same if I’m dialing into zoom? I’m assuming yes but I always appreciate confirmation 😬",1.0,1.0,1.0,3.0,/r/Zoom/comments/p7uhxz/if_im_dialling_into_a_zoom_call_can_i_use_the/,brita09234890235
2021-08-20 15:10:34,"Simple Zoom question. My account is a ""member"" of someone else's Pro account. Does this mean I can create/host meetings beyond 40 minutes?",Thanks in advance!,1.0,1.0,1.0,3.0,/r/Zoom/comments/p7x4al/simple_zoom_question_my_account_is_a_member_of/,yogidelphic
2021-08-20 18:09:07,Organisation seeing/logging what was screen shared,[deleted],1.0,1.0,1.0,2.0,/r/Zoom/comments/p82a21/organisation_seeinglogging_what_was_screen_shared/,[deleted]
2021-08-20 19:30:47,Zoom being very slow to load following update,"Hi,
Recently updated Zoom and it is now taking up to seven minutes to load when I open the app.

Has anyone experienced this problem, or have an idea of what the problem is and how to remedy it?",1.0,2.0,1.0,7.0,/r/Zoom/comments/p83clz/zoom_being_very_slow_to_load_following_update/,FlamingBearAttack
2021-08-20 19:37:33,Is there a camera hack or extension in Zoom?,"A few people in my classes have this grey screen when they turn their camera on. It shows that their camera is on, but all I see is a grey screen. Idk if this is a technical glitch on my side or if they are using some software for it. But whatever it is, can someone tell me how to get the same?",1.0,1.0,0.67,20.0,/r/Zoom/comments/p83g28/is_there_a_camera_hack_or_extension_in_zoom/,Automatic_Debt_2465
2021-08-20 20:33:35,"I closed zoom yesterday, but it's been doing something in the background for hours and hours. 😲 what has it been doing?",,0.0,1.0,1.0,4.0,/r/Zoom/comments/p84aea/i_closed_zoom_yesterday_but_its_been_doing/,joemikolai
2021-08-20 21:54:09,Content of large information,,0.0,1.0,1.0,2.0,/r/Zoom/comments/p85nuz/content_of_large_information/,Starlight-786
2021-08-20 22:24:13,Content of Men's health,,0.0,1.0,1.0,2.0,/r/Zoom/comments/p868u6/content_of_mens_health/,Starlight-786
2021-08-20 22:43:03,Hardware recommendations for conference room (compatible with MS Teams),[removed],1.0,1.0,1.0,2.0,/r/Zoom/comments/p86m5b/hardware_recommendations_for_conference_room/,mrflinigan
2021-08-20 22:59:34,I blocked someone too well,me and my friend had a big argument and I blocked them. but now when we try to send friend requests it wont send (like we are still blocked). we both checked our blocked users and we weren't there. so we cant send friend requests and I don't want to make a new account,1.0,3.0,1.0,5.0,/r/Zoom/comments/p86xmg/i_blocked_someone_too_well/,Mineminemeyt
2021-08-21 02:00:38,Video switches off when I switch to another app (android),[removed],1.0,1.0,1.0,2.0,/r/Zoom/comments/p8agsl/video_switches_off_when_i_switch_to_another_app/,carrenx
2021-08-21 02:44:12,How do I prevent my Zoom audio from dropping every time I get an alert from my PC?,"Every time I get an email alert, or an alert from my chat notification, or any other audio tone from my device, my Zoom meeting mutes for about 5 seconds. It's not my microphone that mutes, but I am unable to hear anyone talking for about 5 seconds. How can I prevent this?",1.0,3.0,1.0,5.0,/r/Zoom/comments/p8bb3i/how_do_i_prevent_my_zoom_audio_from_dropping/,JulianFromReddit
2021-08-21 03:05:19,Not me but participant’s video keep freezing after 10 seconds,[removed],1.0,1.0,1.0,2.0,/r/Zoom/comments/p8bplq/not_me_but_participants_video_keep_freezing_after/,Interesting_Long_193
2021-08-21 03:35:11,Zoom keeps freezing. I bet you won't be able to figure this one out lol!,"Okay this is a doozy...so if you can figure it out, I will forever be in your favor lol. So my wife works for a hospital as a credential trainer. She teaches nurses on the Epic System. She works from home (we live in a new apartment that was built last year) and needs to teach remotely using Zoom. When she is sharing her screen and teaching it freezes for like 30 seconds, then comes back and does that several times through out the session. We have literally tried everything to figure out what it is. Some troubleshooting for your information:

1. I use zoom on my laptop and share my screen I do not have this issue.
2. She used a different computer from the hospital and tried it, but still had the same issue.
3. We got a new modem, but still had the same issue.
4. She tried teaching at different locations like her parents house or onsite at the hospital and both of those locations had ***no issues***, Zoom was working perfectly fine.
5. It is not the internet connection at our apartment because she hardwired using an Ethernet cable and still had the same issue. We preformed an internet speed test and all of the speeds were high.

We are thinking it has to do with the VPN, since she works for a hospital the security is super high...so maybe Zoom is having trouble communicating with the internet of our apartment plus the VPN security firewall is getting clogged up? I have no idea. She thinks it is the apartment itself, but then why does my Zoom have no issues? If it was the apartment layout/tech wouldn't it be affecting me as well? Btw all other video applications work for her no problem as well. Microsoft Teams works perfectly fine and does not have the same issue. This issue has been going on for months now and we are stuck. We tried calling comcast our internet provider and the hospital and we have troubleshot with them all...and they can't even figure it out. Hoping someone can provide some insight on this, thanks!",1.0,2.0,1.0,19.0,/r/Zoom/comments/p8c9j0/zoom_keeps_freezing_i_bet_you_wont_be_able_to/,RandomDuckhead
2021-08-21 05:17:55,"Help! Whenever I use the 'Call Me' feature to dial into Zoom, I'm always not muted, even though my default settings are set so that I'm supposed to be muted when I join a Zoom.",[removed],1.0,1.0,1.0,2.0,/r/Zoom/comments/p8e7l5/help_whenever_i_use_the_call_me_feature_to_dial/,bridgeplease
2021-08-21 07:28:30,Enable a Zoom Update Notification/Alert (PC)?,"Is there a way that I can enable an alert either through the desktop app or perhaps an email that lets me know that Zoom needs to be updated? Or is there perhaps a way that Zoom can update in the background instead of doing it as I'm joining a meeting?

I can't be the only one that gets frustrated by the unexpected and always untimely updates. I shouldn't have to change my behavior and join every digital meeting 3-5 mins early in the off chance that Zoom needs an update.",1.0,2.0,1.0,4.0,/r/Zoom/comments/p8gh7n/enable_a_zoom_update_notificationalert_pc/,maygit88
2021-08-21 08:07:07,Zoom doesn't let me export and copy chat,[removed],1.0,1.0,1.0,2.0,/r/Zoom/comments/p8h36z/zoom_doesnt_let_me_export_and_copy_chat/,Numerous_Nectarine90
2021-08-21 09:38:13,HALP! When I download a meeting from the cloud its an audio file (m4a) only? But I need the video too : (,[removed],1.0,1.0,1.0,2.0,/r/Zoom/comments/p8ihto/halp_when_i_download_a_meeting_from_the_cloud_its/,NDEntrepreneurs
2021-08-21 09:44:37,Random joiners not at the meeting time (with password)?,[removed],1.0,1.0,1.0,2.0,/r/Zoom/comments/p8il9z/random_joiners_not_at_the_meeting_time_with/,offskiff
2021-08-21 12:03:44,Zoom video keeps freezing since the update. Please help!,[removed],1.0,1.0,1.0,2.0,/r/Zoom/comments/p8kny7/zoom_video_keeps_freezing_since_the_update_please/,thenewneda
2021-08-21 21:08:54,URGENT Zoom won't let me upgrade,"So I'm using Zoom for my wedding in 9 hours, meant to upgrade to Pro sooner and but whatever lol. Trying to pay and it won't take any payments. It just freezes on processing my payment for a long time and never goes through. Help??",1.0,2.0,1.0,18.0,/r/Zoom/comments/p8r5x6/urgent_zoom_wont_let_me_upgrade/,YukaHiKn
2021-08-21 21:48:29,New ‘Jeopardy!’ host Mike Richards steps down,NA,1.0,1.0,1.0,2.0,/r/Zoom/comments/p8rrpx/new_jeopardy_host_mike_richards_steps_down/,[deleted]
2021-08-21 23:12:42,Not a bandwidth issue. My video keeps freezing,[removed],1.0,1.0,1.0,2.0,/r/Zoom/comments/p8t61h/not_a_bandwidth_issue_my_video_keeps_freezing/,Least_Information
2021-08-22 00:10:32,Do I have to upgrade from basic to stay in Zoom meeting with more than 3 participants for more than 40 minute?,[removed],1.0,1.0,1.0,2.0,/r/Zoom/comments/p8u67t/do_i_have_to_upgrade_from_basic_to_stay_in_zoom/,EMJ92
2021-08-22 04:09:54,Finding People to Zoom With,[removed],1.0,1.0,1.0,3.0,/r/Zoom/comments/p8yczi/finding_people_to_zoom_with/,Xax9
2021-08-22 04:20:53,Can I make it so that only the host's camera is displayed?,"I run Zoom sessions for a club. It is stressful because when we are having events other people will come into the session unmuted and they will make a sound causing their camera to be what's on everyone's screen instead of the host camera. Can I lock it so that everyone else is permanently muted, or make it so that the host video is what's displayed at all times for everyone?

Thanks.",1.0,1.0,1.0,14.0,/r/Zoom/comments/p8yjki/can_i_make_it_so_that_only_the_hosts_camera_is/,BarryTheMasterOfSand
2021-08-22 07:37:35,I registered for the same Zoom meeting twice (same email and everything),"Is that a problem? 

Should I cancel one? 

What would that entail?",1.0,1.0,1.0,5.0,/r/Zoom/comments/p91s2r/i_registered_for_the_same_zoom_meeting_twice_same/,areintelligent
2021-08-22 11:47:16,Anyone know a way I can integrate constant contact with my zoom meetings?,I'm trying to set up a system that creates a new contact in Constant Contact whenever there is a new registrant in one of my zoom meetings. Any suggestions?,1.0,1.0,1.0,3.0,/r/Zoom/comments/p95gr0/anyone_know_a_way_i_can_integrate_constant/,kwasi3114
2021-08-23 00:45:38,Breakout room confusion,[removed],1.0,1.0,1.0,2.0,/r/Zoom/comments/p9fwx1/breakout_room_confusion/,Xanhasht
2021-08-23 01:40:32,Audio Popping Noise When Screen Sharing,[removed],1.0,1.0,1.0,2.0,/r/Zoom/comments/p9gz61/audio_popping_noise_when_screen_sharing/,CapitalKitties
2021-08-23 04:43:56,"Downloading zoom recordings, can they see me doing that?",[removed],1.0,1.0,1.0,2.0,/r/Zoom/comments/p9kjpg/downloading_zoom_recordings_can_they_see_me_doing/,andrebit26
2021-08-23 06:34:33,Zoom,,0.0,1.0,1.0,2.0,/r/Zoom/comments/p9ml4w/zoom/,Victor-Martin705
2021-08-23 08:27:28,Anyone got a zoom I can troll?,[removed],1.0,1.0,1.0,0.0,/r/Zoom/comments/p9oif6/anyone_got_a_zoom_i_can_troll/,Izzy_Milo
2021-08-23 09:56:54,Bluetooth mic for zoom wedding?,[removed],1.0,1.0,1.0,2.0,/r/Zoom/comments/p9pyvt/bluetooth_mic_for_zoom_wedding/,Percocet_Jackson
2021-08-23 09:57:17,zoom camera pixelated. any solutions? regular camera works fine,,0.0,1.0,1.0,2.0,/r/Zoom/comments/p9pz3i/zoom_camera_pixelated_any_solutions_regular/,alancmarcia
2021-08-23 14:24:20,HOW TO DO,,0.0,1.0,1.0,3.0,/r/Zoom/comments/p9u005/how_to_do/,Calxifyy
2021-08-23 14:34:31,HOW DOES ZOOM GLITCH THIS BAD,"BRO THIS SHIT GLITCHED WHEN I SPAMMED TO MANY FIRE EMOJIS

https://preview.redd.it/qa3yvvuny1j71.png?width=1920&amp;format=png&amp;auto=webp&amp;s=e46c6ecc0c3fd503243370d0a54a9b46caef8435

https://preview.redd.it/16jyovuny1j71.png?width=1920&amp;format=png&amp;auto=webp&amp;s=da9141252dcc81de5153eab2130c0fdfe45e787c",1.0,1.0,1.0,4.0,/r/Zoom/comments/p9u4ls/how_does_zoom_glitch_this_bad/,Calxifyy
2021-08-23 15:24:46,Is zoom currently down?,[removed],1.0,1.0,1.0,2.0,/r/Zoom/comments/p9ur3v/is_zoom_currently_down/,humanoid82
2021-08-23 15:57:46,"getting ""meeting has been ended by host"" error everytime i start meeting",[removed],1.0,1.0,1.0,2.0,/r/Zoom/comments/p9v553/getting_meeting_has_been_ended_by_host_error/,goregutz619
2021-08-23 16:03:34,Please Help me Zoom," Every time anyone including the host tries to join the meeting it alerts ""Waiting for host to start the meeting",1.0,1.0,1.0,9.0,/r/Zoom/comments/p9v7yf/please_help_me_zoom/,Fixy_dragon
2021-08-23 17:27:11,Zoom is down!,"In Asia, at least. I am in Japan and as of 5:30 p.m. Zoom was down and remains so. Any other outages? If so, what is your location?",1.0,1.0,1.0,7.0,/r/Zoom/comments/p9w8g8/zoom_is_down/,soulcaptain
2021-08-23 20:52:20,AUR errors,[removed],1.0,1.0,1.0,2.0,/r/Zoom/comments/p9z78v/aur_errors/,antolab_
2021-08-23 21:13:31,RecordingCompleted webhook event without host/co-host attending meeting,[removed],1.0,1.0,1.0,2.0,/r/Zoom/comments/p9zkfd/recordingcompleted_webhook_event_without/,0x4ddd
2021-08-23 23:05:04,"Sorry, your session was expired. Please refresh the page or login again.",[removed],1.0,1.0,1.0,2.0,/r/Zoom/comments/pa1nvl/sorry_your_session_was_expired_please_refresh_the/,ketetinha
2021-08-24 00:13:58,zoom rai.d omg,[removed],1.0,1.0,1.0,1.0,/r/Zoom/comments/pa32hk/zoom_raid_omg/,halaluser69
2021-08-24 00:47:34,NEWS - ZOOM ARE NOT PLANNING TO RELEASE WINDOWS DARK MODE ANYTIME SOON :/,,0.0,1.0,1.0,12.0,/r/Zoom/comments/pa3qbi/news_zoom_are_not_planning_to_release_windows/,Itz_Raj69_
2021-08-24 01:10:27,Can’t see chat messages,"I use zoom on both desktop and iPhone. Occasionally, my chats will become encrypted and one of us will have to log in on the desktop in order for them to become visible to both parties again. 

When/why does this happen and how to prevent it? It’s a real pain when you’re mobile and can’t read what someone is messaging you.",1.0,1.0,1.0,4.0,/r/Zoom/comments/pa476s/cant_see_chat_messages/,DK03
2021-08-24 02:18:15,Zoom crashing in breakout rooms,Any known solution to this issue? I have mandatory meetings which integrates this and it's giving me negative press in the meeting because I'm the only one with this issue,1.0,1.0,1.0,4.0,/r/Zoom/comments/pa5l3e/zoom_crashing_in_breakout_rooms/,forpdongle
2021-08-24 02:30:16,ZOOM Screen Flashing!! 🥲😪,,0.0,1.0,1.0,2.0,/r/Zoom/comments/pa5tkz/zoom_screen_flashing/,Elgeogomez84
2021-08-24 02:50:26,Getting a log of reactions/hand raises,[removed],1.0,1.0,1.0,2.0,/r/Zoom/comments/pa67nv/getting_a_log_of_reactionshand_raises/,One_Eyed_Mind
2021-08-24 03:02:25,Question about polls and restrictions,[removed],1.0,1.0,1.0,2.0,/r/Zoom/comments/pa6giu/question_about_polls_and_restrictions/,juankorn
2021-08-24 03:54:07,"Dear God, how do you mute shared sound?","I know for a fact that we used to be able to do this, but all of a sudden the option appears to be gone, and I'm about to go insane from having to listen to someone's crappy music. Please, PLEASE tell me it was just moved, and I'm not seeing it...please...",1.0,1.0,1.0,3.0,/r/Zoom/comments/pa7gft/dear_god_how_do_you_mute_shared_sound/,TheOneTrueChris
2021-08-24 04:50:15,Zoom Time Stuck an hour behind,[removed],1.0,1.0,1.0,0.0,/r/Zoom/comments/pa8jmr/zoom_time_stuck_an_hour_behind/,ryana8
2021-08-24 04:52:13,"Time Zone is Accurate, Display is Inaccurate",[removed],1.0,1.0,1.0,0.0,/r/Zoom/comments/pa8kzo/time_zone_is_accurate_display_is_inaccurate/,ryana8
2021-08-24 05:15:27,"If anyone's looking for an excuse to not have your camera on for Zoom call, here's one that also helps save the environment.",,0.0,1.0,1.0,2.0,/r/Zoom/comments/pa9156/if_anyones_looking_for_an_excuse_to_not_have_your/,Dazzling_Pressure_93
2021-08-24 06:43:08,"When you are the host of the Zoom meeting and you are screen sharing a particular tab, can other participants see when you've switched to another tab?",[removed],1.0,1.0,1.0,2.0,/r/Zoom/comments/paao2n/when_you_are_the_host_of_the_zoom_meeting_and_you/,victoria_queen
2021-08-24 07:43:19,How can I get breakout room participant movements in meeting history?,[removed],1.0,1.0,1.0,2.0,/r/Zoom/comments/pabq4l/how_can_i_get_breakout_room_participant_movements/,spiru-lina
2021-08-24 07:47:44,Webcam causes zoom to stop responding,[removed],1.0,1.0,1.0,2.0,/r/Zoom/comments/pabsvc/webcam_causes_zoom_to_stop_responding/,yayhorraydog
2021-08-24 13:35:59,gif pfp,[removed],1.0,1.0,1.0,2.0,/r/Zoom/comments/pah5q1/gif_pfp/,KaedeKayano13
2021-08-24 14:04:20,HOW DO I FIX THIS I HAVE A LOGITECH C310 CAMERA,,0.0,1.0,1.0,6.0,/r/Zoom/comments/pahijw/how_do_i_fix_this_i_have_a_logitech_c310_camera/,Brave_Hedgehog_1979
2021-08-24 14:11:51,"Permanent open call with a ""dummy""-user to facilitate communication?",[removed],1.0,1.0,1.0,2.0,/r/Zoom/comments/pahlxs/permanent_open_call_with_a_dummyuser_to/,Hiiiiiiia
2021-08-24 16:27:31,Zoom glitch,[removed],1.0,1.0,1.0,2.0,/r/Zoom/comments/paj6is/zoom_glitch/,taetae_world
2021-08-24 16:55:01,"On call in Zoom mobile, but doesn't show the status on Desktop app.","Whenever I call on my Zoom mobile app, the presence status shows that I'm available on the Desktop application. 

How do I have it show that I'm on call on the Desktop application when I'm calling through my phone?",1.0,1.0,1.0,2.0,/r/Zoom/comments/pajhli/on_call_in_zoom_mobile_but_doesnt_show_the_status/,eggyolknshells
2021-08-24 18:03:43,Zoom App keeps crashing - but running the meeting from browser is working fine,"Some teachers keeps dropping out of zoom when using the app, but on the same computer are running the classes fine when using the browser and not the app? Is there any setting that I can check in the app? Uninstall did not solve the problem?",1.0,1.0,1.0,2.0,/r/Zoom/comments/pakaqx/zoom_app_keeps_crashing_but_running_the_meeting/,JacquesGouws
2021-08-24 18:07:02,Slow Starting Zoom App,[removed],1.0,1.0,1.0,0.0,/r/Zoom/comments/pakcdl/slow_starting_zoom_app/,JacquesGouws
2021-08-24 20:37:00,Blur webcam background when using OBS virtual camera,[removed],1.0,1.0,1.0,3.0,/r/Zoom/comments/pamgzj/blur_webcam_background_when_using_obs_virtual/,AppearanceNo2323
2021-08-24 22:11:15,Zoom app call drops when wifi connection changes,"Upon occasion, I use the zoom app (mobile, iPhone) when travelling to listen in to a meeting. Whenever I arrive/leave a location and my internet connection changes from wifi to data (or vice versa), the call freezes and drops. I was wondering if there is a way to prevent this, other than just completely turning off wifi? With other calls/apps, it often temporarily freezes, but it usually picks back up after a few seconds. With Zoom, I have to completely hang up the call and reconnect.",1.0,1.0,1.0,7.0,/r/Zoom/comments/pao4gp/zoom_app_call_drops_when_wifi_connection_changes/,MyNthRedditAcct
2021-08-24 23:50:03,Error 5003,"Hello, I’ve been having an issue with zoom. I recently got a new laptop and needed zoom to join a class but was unable to due to error 5003. My old laptop never had this issue and my new one shouldn’t be different. I have perfect WiFi connection so no issue there. I looked at dozens of videos trying to fix the error and tried all the solutions yet all have failed. Anybody have a solution here? Please, my college classes depend on it.",1.0,1.0,1.0,5.0,/r/Zoom/comments/paq0cs/error_5003/,CupOfDirt777
2021-08-25 06:14:32,Zoom causing computer to freeze - GPU 3D Spikes to 100% - How do I change this?,[removed],1.0,1.0,1.0,2.0,/r/Zoom/comments/paxmtz/zoom_causing_computer_to_freeze_gpu_3d_spikes_to/,jennings709
2021-08-25 06:16:59,zoom blocked contacts,[removed],1.0,1.0,1.0,2.0,/r/Zoom/comments/paxonl/zoom_blocked_contacts/,lerlune
2021-08-25 07:16:17,Remote control function not showing,[removed],1.0,1.0,1.0,2.0,/r/Zoom/comments/payryw/remote_control_function_not_showing/,Own-Performer-4297
2021-08-25 12:40:01,is buying Zoom Subcriptions online safe ?,[removed],1.0,1.0,1.0,2.0,/r/Zoom/comments/pb43u4/is_buying_zoom_subcriptions_online_safe/,soosoosoo
2021-08-25 15:05:57,Zoom won't adjust exposure on the mobile app,Any know how to fix this?,1.0,1.0,1.0,2.0,/r/Zoom/comments/pb61yu/zoom_wont_adjust_exposure_on_the_mobile_app/,godfatherofjesus
2021-08-25 15:15:02,Help,[removed],1.0,1.0,1.0,0.0,/r/Zoom/comments/pb6606/help/,Keqingsimp420
2021-08-25 15:16:53,Separating discord and zoom mic audio,[removed],1.0,1.0,1.0,0.0,/r/Zoom/comments/pb66x2/separating_discord_and_zoom_mic_audio/,Keqingsimp420
2021-08-25 16:02:34,"Late to a meeting this morning because ""this site can't be reached"" (on wi-fi only, hotspot with my phone was possible)",,0.0,1.0,1.0,2.0,/r/Zoom/comments/pb6qqc/late_to_a_meeting_this_morning_because_this_site/,sylnvapht
2021-08-25 17:24:14,Is there a way to switch to Zoom?,[removed],1.0,1.0,1.0,2.0,/r/Zoom/comments/pb7omo/is_there_a_way_to_switch_to_zoom/,Mr-Flaaaaame
2021-08-25 19:19:52,Zoom on windows does not save credentials,[removed],1.0,1.0,1.0,2.0,/r/Zoom/comments/pb96cj/zoom_on_windows_does_not_save_credentials/,deebeecom
2021-08-25 19:43:38,Hey! I made a short video on how to get started with Zoom in just under 10 mins! Let me know your feedback.,,0.0,1.0,1.0,2.0,/r/Zoom/comments/pb9irg/hey_i_made_a_short_video_on_how_to_get_started/,CoolerDude_Reddit
2021-08-25 21:27:34,Please Sign,[removed],1.0,1.0,1.0,3.0,/r/Zoom/comments/pbb79n/please_sign/,Delicious-Move9262
2021-08-25 21:34:51,profile picture size 2M?,what  is size 2M and how do I make my picture that size? Is it 2mb? or 2x2inch?,1.0,1.0,1.0,3.0,/r/Zoom/comments/pbbbzi/profile_picture_size_2m/,Arik_the_Bruce
2021-08-25 21:44:28,Zoom Crashing Internet Connection - usb connections,"I found an archived thread with this title because I was looking for a fix for why zoom kept crashing and causing my computer to lose its internet connection after a few minutes of joining a zoom meeting.  Tons of other Redditors were having the same problem apparently. 

 I tried every suggested fix, none worked.  However, what did work was changing the way my hp laptop is connected to the network router.  I was using a wired connection plugged into a usb-c hub connected to my laptop.  Someone in a hp forum suggested that usb internet connections could be the culprit.  Lo and behold, when I unplugged the usb-c wired connection and instead connect directly to wifi using my laptop's built-in wireless the problem dissappeared and has not come back!  

Hope this helps someone else.",1.0,1.0,1.0,6.0,/r/Zoom/comments/pbbibc/zoom_crashing_internet_connection_usb_connections/,Beautiful-Cookie
2021-08-25 23:09:00,How to block/mute/hide a participant in Zoom without removing them?,[removed],1.0,1.0,1.0,2.0,/r/Zoom/comments/pbd6bn/how_to_blockmutehide_a_participant_in_zoom/,BigEffort
2021-08-25 23:42:16,About attendance sheets and accounts,"Hello. I am having classes at the university (at zoom) and my professor said he is taking the attendance list using the tools allowed by the zoom. We are going to have the fourth class already and i realized that i had joined the classes without do my login. I join just with my name. I have a question: Do the zoom attendance list say that i was present even if i didn't use my account? That is, the attendance list register people that is not logged too?",1.0,1.0,1.0,3.0,/r/Zoom/comments/pbdunf/about_attendance_sheets_and_accounts/,Dramatic-Bluebird755
2021-08-26 00:20:04,how do i get rid of this black box on my zoom it is from my window camera at the top not screen share,,0.0,1.0,1.0,2.0,/r/Zoom/comments/pbelxr/how_do_i_get_rid_of_this_black_box_on_my_zoom_it/,d3adandbr0k3n
2021-08-26 00:48:28,Zoom Minimizes Windows On Shared Screen,[removed],1.0,1.0,1.0,2.0,/r/Zoom/comments/pbf6gs/zoom_minimizes_windows_on_shared_screen/,the-greek-geek-
2021-08-26 03:53:08,Does anyone know how I make it so every time someone types something in chat it doesn’t pop up in screen?,"I don’t need to see people making shitty jokes in chat all class, it’s very distracting.",1.0,1.0,1.0,4.0,/r/Zoom/comments/pbiy25/does_anyone_know_how_i_make_it_so_every_time/,the_prion
2021-08-26 05:36:49,Funny Funniest Zoom &amp; Video Conferencing Commercials | Compilation.,,0.0,1.0,1.0,2.0,/r/Zoom/comments/pbl1pq/funny_funniest_zoom_video_conferencing/,eureka_yess
2021-08-26 07:04:51,Meeting ID: 682 8708 3600 Passcode: 068240,[removed],1.0,1.0,1.0,2.0,/r/Zoom/comments/pbmrbe/meeting_id_682_8708_3600_passcode_068240/,x1jw
2021-08-26 07:13:30,Getting kicked out of meeting when another starts - how to avoid?,[removed],1.0,1.0,1.0,2.0,/r/Zoom/comments/pbmx4j/getting_kicked_out_of_meeting_when_another_starts/,fotomateo
2021-08-26 10:07:47,screen sharing issue,"hi!

so recently i tried to screen-share a movie viewing with my mate on stan; my screen share usually always works and everything was fine, the audio and all. but instead of displaying the film, it was just a black screen? like you could see the subtitles, the screen layout, the play button and everything but no actual movie it was just black. the audio could be heard too. i restarted, re-launched and tried everything but nothing worked. this used to work before i don't know what's wrong.

Does anyone know how to fix this? thank you :)",1.0,1.0,1.0,3.0,/r/Zoom/comments/pbpy19/screen_sharing_issue/,Xsh_1569
