date,title,selftext,is_self,upvotes,upvote_ratio,n_comments,permalink,author
2021-10-01 01:36:01,OSX Bluetooth Mouse Input Lost Minutes Into Zoom Call,[removed],1.0,1.0,1.0,2.0,/r/Zoom/comments/pyoqo5/osx_bluetooth_mouse_input_lost_minutes_into_zoom/,McFlurriez
2021-10-01 02:15:19,Navigating the Virtual Background Hardware Limitations,[removed],1.0,1.0,1.0,2.0,/r/Zoom/comments/pypj0y/navigating_the_virtual_background_hardware/,Marginalimprovement
2021-10-01 04:41:20,Question regarding breakout rooms,[removed],1.0,1.0,1.0,2.0,/r/Zoom/comments/pysezq/question_regarding_breakout_rooms/,Test_Low
2021-10-01 04:49:45,Can you enter breakout rooms in incognito?,"So I just took an oral exam with some of my fellow students in a breakout room, and I never noticed the professor join our breakout room. I asked them after class and they said they have the power to enter them in incognito without us knowing. I’ve been trying to look and see if this is a real feature but I can’t find it. Is this real?",1.0,1.0,1.0,6.0,/r/Zoom/comments/pyskwf/can_you_enter_breakout_rooms_in_incognito/,Austin7644
2021-10-01 05:38:39,How to prevent user emails from being shared with Zoom hosts?,[removed],1.0,1.0,1.0,2.0,/r/Zoom/comments/pytjcm/how_to_prevent_user_emails_from_being_shared_with/,milkygirl21
2021-10-01 05:44:14,Somebody troll the zoom call at 6:15 PM 😂😂,,0.0,1.0,1.0,1.0,/r/Zoom/comments/pytn66/somebody_troll_the_zoom_call_at_615_pm/,Saltyydan
2021-10-01 06:10:48,Minimum phone audio still too loud?,[removed],1.0,1.0,1.0,3.0,/r/Zoom/comments/pyu5h4/minimum_phone_audio_still_too_loud/,Customer-Worldly
2021-10-01 07:03:16,Zoom Apps,Wondering what the general feelings are about zoom apps? Seems like pre-approval is a headache for most companies to get past. Haven't read any positive reviews yet from teachers trying to integrate apps or more corporate companies trying to use the apps in meetings.,1.0,1.0,1.0,2.0,/r/Zoom/comments/pyv3ps/zoom_apps/,TechyAnon3345
2021-10-01 07:18:31,Zoom Tips 2,,0.0,1.0,1.0,2.0,/r/Zoom/comments/pyvd7r/zoom_tips_2/,antdude
2021-10-01 07:33:21,Zoom Announces Termination of Merger Agreement with Five9,,0.0,1.0,1.0,2.0,/r/Zoom/comments/pyvmk7/zoom_announces_termination_of_merger_agreement/,HotMomentumStocks
2021-10-01 08:15:55,Join,[removed],1.0,1.0,1.0,0.0,/r/Zoom/comments/pywdg6/join/,juandiego2810
2021-10-01 09:16:13,Five9 and Zoom Mutually Agree to Terminate Merger Agreement | Business Wire,,0.0,1.0,1.0,2.0,/r/Zoom/comments/pyxeue/five9_and_zoom_mutually_agree_to_terminate_merger/,Guabiru_BR
2021-10-01 10:45:53,Can I see what meeting I attended last or who hosted it?,I cannot for the life of me remember someone’s name and this is my only way to find out,1.0,1.0,1.0,2.0,/r/Zoom/comments/pyywjo/can_i_see_what_meeting_i_attended_last_or_who/,cabandon
2021-10-01 10:59:52,How can I share audio even when my computer is muted?,"With my former laptop I used to share screen and the audio would also be broadcasted no matter the level of volume on my end. It could be 100% or 0% in my computer but the broadcasted audio level would not change.

But, since I got a new computer I cannot find a setting to do the same operation. The audio that is being transmited will vary depending on the volume on my computer. When I mute my computer, the broadcast is also muted. 

Is there a setting I'm not finding? Or is it just a new update?",1.0,1.0,1.0,2.0,/r/Zoom/comments/pyz4kp/how_can_i_share_audio_even_when_my_computer_is/,SirLukeIII
2021-10-01 12:37:40,Zoom abandons its $14.7 billion acquisition of Five9 plan,,0.0,1.0,1.0,2.0,/r/Zoom/comments/pz0nua/zoom_abandons_its_147_billion_acquisition_of/,amancoreseg
2021-10-01 15:19:18,Five9 and Zoom Mutually Agree to Terminate Merger Agreement,,0.0,1.0,1.0,2.0,/r/Zoom/comments/pz2uoq/five9_and_zoom_mutually_agree_to_terminate_merger/,SadOutlandishness719
2021-10-01 15:35:10,Markets: Zoom Walks Back On $15B Five9 Deal,,0.0,1.0,1.0,2.0,/r/Zoom/comments/pz31pg/markets_zoom_walks_back_on_15b_five9_deal/,The-Techie
2021-10-01 17:53:22,Just Say the Word!,"Hi guys, Doppio here, developer of the game Just Say the Word! in the App Marketplace.   
We'd love to get some feedback about the game from the community, as we're aiming to improve the game little by little. 

Here's some feedback we've gotten so far, feel free to add your own:   
\- Amount of cards (if you connect your account to Voice Club, you get some extra ones), which we're working on adding

\- We have the feature to create your own cards in the roadmap as well. 

Would love to get your thoughts and ideas, if you had found the game before and where you'd like to see it advertised or mentioned. Thanks!",1.0,1.0,1.0,3.0,/r/Zoom/comments/pz4q17/just_say_the_word/,Heavy_Survey1660
2021-10-01 18:27:22,iOS Question,"Hi! If I switch from the zoom app to another app on iOS while on a video call, will my camera be turned off too? I want to do it in a stealthy way. Thank you.",1.0,1.0,1.0,2.0,/r/Zoom/comments/pz569t/ios_question/,Falconr3
2021-10-01 20:25:10,iPhone Camera,[removed],1.0,1.0,1.0,2.0,/r/Zoom/comments/pz6wcs/iphone_camera/,tterrill11375
2021-10-01 21:32:11,Zoom for iOS/iPadOS with Outlook,[removed],1.0,1.0,1.0,2.0,/r/Zoom/comments/pz830r/zoom_for_iosipados_with_outlook/,ThorNike13
2021-10-01 22:14:23,How to disconnect Paypal without zoom login details?,"Hi, Is there a way to disconnect the Paypal without login into zoom? Paypal account is mine. Can contact Paypal support, and do any changes if needed.",1.0,1.0,1.0,4.0,/r/Zoom/comments/pz8wr8/how_to_disconnect_paypal_without_zoom_login/,sdw23
2021-10-01 22:29:52,Cannot Connect iPad via Cable on Mac Zoom,There is no trust button popping up on my iPad. I even tried resetting location and privacy settings but iPad wouldn't let me reset (i.e iPad doesn't restart).,1.0,1.0,1.0,2.0,/r/Zoom/comments/pz97km/cannot_connect_ipad_via_cable_on_mac_zoom/,NaturalEnvironment31
2021-10-01 23:26:37,Zoom working in other countries??,[removed],1.0,1.0,1.0,2.0,/r/Zoom/comments/pzabuc/zoom_working_in_other_countries/,CJones899
2021-10-02 01:00:31,How to record videos with internal sound in an android device without permission from host,[removed],1.0,1.0,1.0,2.0,/r/Zoom/comments/pzc8nj/how_to_record_videos_with_internal_sound_in_an/,QuestionAskerThrower
2021-10-02 01:08:10,Is the 62-bit version of zoom faster than the 32-bit?,The 32-bit version of zoom is acting slow for me so I wanna know if the 62 bit will be any better.,1.0,1.0,1.0,12.0,/r/Zoom/comments/pzcerb/is_the_62bit_version_of_zoom_faster_than_the_32bit/,Heavy_Jackfruit4736
2021-10-02 02:14:08,Zoom Stock Drop - Five9 Deal,,0.0,1.0,1.0,2.0,/r/Zoom/comments/pzdqyr/zoom_stock_drop_five9_deal/,10marketing8
2021-10-02 06:43:54,Zoom Tips 3,,0.0,1.0,1.0,3.0,/r/Zoom/comments/pzixt6/zoom_tips_3/,antdude
2021-10-02 09:37:08,How do I fix this? I accidentally pressed something and now it does not want to show my video,[removed],1.0,1.0,0.99,2.0,/r/Zoom/comments/pzlsym/how_do_i_fix_this_i_accidentally_pressed/,KirbyPlayz__
2021-10-02 21:40:59,"Issue with cursor leaving text box, can anyone help?","For the past while now, when I’m typing in an annotation on the screen or on the whiteboard, my cursor will randomly leave the text box and I’ll have to click it again to continue typing. It’s pretty frustrating. Has this happened to anyone else? Is there fix? I honestly have no clue what could be causing it.",1.0,1.0,1.0,4.0,/r/Zoom/comments/pzvd49/issue_with_cursor_leaving_text_box_can_anyone_help/,hornylittlegrandpa
2021-10-02 23:52:03,Zoom windows audio not working,"Hi guys,

My zoom was working fine all the while but today the audio suddenly stopped working (i cant hear the speaker and people cant hear me). I’ve tried testing the different speakers, using diff headsets, uninstalled and install zoom, rebooting my computer etc but nothing seems to work.

Any help is appreciated. Thank you!",1.0,1.0,1.0,5.0,/r/Zoom/comments/pzxqis/zoom_windows_audio_not_working/,Playful-Ad1643
2021-10-03 02:07:45,Can anyone explain how this happened?,,0.0,1.0,1.0,2.0,/r/Zoom/comments/q0086b/can_anyone_explain_how_this_happened/,Arctic_Wolf420
2021-10-03 07:51:09,PLEASE HELP!!!!,[removed],1.0,1.0,1.0,2.0,/r/Zoom/comments/q06bdu/please_help/,rafaelsmarques
2021-10-03 08:48:36,Can’t blur my camera.,"Hello, 

Today I made a meeting and I noticed that few of my partners had this feature. So when I went to Backgrounds, I wasn’t there. The only options is San Francisco, The Earth and Grass. How do I get the blue effect on the background? Any help will be appreciated.

Sincerely,

FPR1

Ps. I have the latest version!",1.0,1.0,1.0,7.0,/r/Zoom/comments/q079qe/cant_blur_my_camera/,FreemanPR1
2021-10-03 10:20:07,Audio transfer only,[removed],1.0,1.0,1.0,2.0,/r/Zoom/comments/q08q7b/audio_transfer_only/,rcx918
2021-10-03 11:28:46,how to use Zoom in mainland China,[removed],1.0,1.0,1.0,2.0,/r/Zoom/comments/q09s7b/how_to_use_zoom_in_mainland_china/,Direct-Tomorrow143
2021-10-03 12:15:57,Sharing document but don't want download. Possible?,[removed],1.0,1.0,1.0,2.0,/r/Zoom/comments/q0ahlq/sharing_document_but_dont_want_download_possible/,rockyroad2a
2021-10-03 12:41:29,"Hi. I have a problem w my zoom app. I want to change the BG during the meeting, but i cannot find “Background and filter” in zoom setting. Please help me. Many thanks",,0.0,1.0,1.0,2.0,/r/Zoom/comments/q0auni/hi_i_have_a_problem_w_my_zoom_app_i_want_to/,huang_yun
2021-10-03 16:26:28,Zoom Room Windows IoT?,[removed],1.0,1.0,1.0,2.0,/r/Zoom/comments/q0dqyl/zoom_room_windows_iot/,planetary_funk_alert
2021-10-03 20:42:59,Is there any way to do concurrent webinars with one account?,[removed],1.0,1.0,1.0,2.0,/r/Zoom/comments/q0gzx1/is_there_any_way_to_do_concurrent_webinars_with/,Ready_Reindeer_803
2021-10-04 06:07:27,Online Teambuilding Idea With Zoom Whiteboard App,,0.0,1.0,1.0,2.0,/r/Zoom/comments/q0ryt6/online_teambuilding_idea_with_zoom_whiteboard_app/,Nerfmeplix
2021-10-04 06:08:56,Is there a way or a site where I can find public zoom meetings to join?,[removed],1.0,1.0,1.0,2.0,/r/Zoom/comments/q0rzty/is_there_a_way_or_a_site_where_i_can_find_public/,methal_knight
2021-10-04 10:26:17,Combining Pre-assigned Breakout Rooms,[removed],1.0,1.0,1.0,2.0,/r/Zoom/comments/q0we2u/combining_preassigned_breakout_rooms/,jaxlieu
2021-10-04 18:06:22,How To Install Zoom For All Users On PC,,0.0,1.0,1.0,2.0,/r/Zoom/comments/q12ghn/how_to_install_zoom_for_all_users_on_pc/,freeITSupport
2021-10-04 19:29:39,"I Can't activate ""Polls"", It doesn't appear in Zoom Settings",[removed],1.0,1.0,1.0,2.0,/r/Zoom/comments/q13k7v/i_cant_activate_polls_it_doesnt_appear_in_zoom/,FlinchoPeru
2021-10-04 23:22:18,Setup needed to run hybrid seminar-style events on Zoom,"Over the pandemic I have become quite proficient in running Zoom webinars and even large scale conferences using Zoom and Whova. But as we reopen my org wants to move to a hybrid model, where we will have in-person seminars, which will be streamed live via Zoom as well.

Anyone have suggestions in terms of equipment and setup needed without breaking the bank? Thanks!",1.0,1.0,1.0,6.0,/r/Zoom/comments/q17kaq/setup_needed_to_run_hybrid_seminarstyle_events_on/,DrBengali
2021-10-05 00:12:46,My mic echos when I share computer audio?,[removed],1.0,1.0,1.0,2.0,/r/Zoom/comments/q18mj6/my_mic_echos_when_i_share_computer_audio/,stephenyavorski
2021-10-05 00:26:07,Why is my icon crossed out? I was messing with settings and now I can’t get it back to normal,,0.0,1.0,1.0,7.0,/r/Zoom/comments/q18wus/why_is_my_icon_crossed_out_i_was_messing_with/,tac0b3lld3bat3
2021-10-05 00:37:24,External Zoom Contact gone?,"Hi all, just today I logged in to my Zoom account and noticed that my external Zoom contact, who used to be in my contact list, is now gone. I still can see the name and the chat history, but when I open it, it says that I need to add this contact to my contact list in order to write into the chat or see his status. When I click on the profile, it says “Add xxx to your contacts“. As far as I know, I didn’t remove him though. Does it mean I have been removed from this contact‘s list? I have searched on the internet already but apparently, this didn’t happen to anybody else. I read when you’re blocked, you wouldn’t notice it so I‘m wondering if anybody else has had the same issue as me. Thanks!",1.0,1.0,1.0,4.0,/r/Zoom/comments/q195e2/external_zoom_contact_gone/,katemma199
2021-10-05 00:39:19,Zoom Webinar - suitable for my needs?,[removed],1.0,1.0,1.0,2.0,/r/Zoom/comments/q196tp/zoom_webinar_suitable_for_my_needs/,RollDeepRegular7
2021-10-05 02:04:15,Zoom keeps freezing and crashing!,[removed],1.0,1.0,1.0,2.0,/r/Zoom/comments/q1b2mm/zoom_keeps_freezing_and_crashing/,AdhamTB
2021-10-05 02:45:04,What do you think of this new feature in Zoom?,,0.0,1.0,1.0,2.0,/r/Zoom/comments/q1bz4r/what_do_you_think_of_this_new_feature_in_zoom/,scottbrand
2021-10-05 02:57:39,Zoom doesn't care enough about enterprise customers.,[removed],1.0,1.0,1.0,0.0,/r/Zoom/comments/q1c9dk/zoom_doesnt_care_enough_about_enterprise_customers/,caseym21
2021-10-05 04:06:41,Anyone else attent Zoomtopia and being bombarded with spam from digital service companies?,[removed],1.0,1.0,1.0,2.0,/r/Zoom/comments/q1dudl/anyone_else_attent_zoomtopia_and_being_bombarded/,empanadamn_
2021-10-05 04:25:45,zoom camera webinar,I was in a zoom webinar and I went to audio settings (where there also happened to be video settings) and accidentally turned on my camera. Did the rest of the webinar see me? I'm not a host or panelist or anything,1.0,1.0,1.0,3.0,/r/Zoom/comments/q1ea9z/zoom_camera_webinar/,chiiquitita
2021-10-05 04:45:42,Multiple cameras to one Zoom meeting,"We are trying to think of a way to better engage on-site people with the virtual people for meetings. One thought was to have multiple cameras in a room so people could sit socially distanced. Each camera would be on a small tripod in front of the on-site participant so that remote people could better see each participant. My thought was to have all of these cameras feed into one Zoom meeting so it looked as if many people joined in, though a chunk of them are in the same room together. 

Another idea was multiple laptops all joining the same meeting from the same room, but my thought is the logistics behind ensuring people are muting at the right time, joining the right meeting, not spilling stuff on laptops, etc., etc. would make it the more complex (and expensive) solution. 

I've seen that Zoom only supports 2 camera feeds so I'm not sure this would even be possible. Any ideas here would certainly be helpful.",1.0,1.0,1.0,12.0,/r/Zoom/comments/q1eqrw/multiple_cameras_to_one_zoom_meeting/,subdriven
2021-10-05 04:58:31,Host getting kicked and slides freezing after polls,[removed],1.0,1.0,1.0,2.0,/r/Zoom/comments/q1f1hc/host_getting_kicked_and_slides_freezing_after/,ishouldnt_behere
2021-10-05 06:44:59,Hi guys i need help i have problems when i open my record session in zoom. I NEED HELPPP,"Look. 

&amp;#x200B;

![img](nmbl3z3vhir71 ""and  
when I click twice nothing happens "")

HELPP",1.0,1.0,1.0,6.0,/r/Zoom/comments/q1hcgc/hi_guys_i_need_help_i_have_problems_when_i_open/,yayirov3444
2021-10-05 07:59:42,How to De-Link an Account from a Temporary Employer,[removed],1.0,1.0,1.0,2.0,/r/Zoom/comments/q1iqix/how_to_delink_an_account_from_a_temporary_employer/,Creative-Ad3783
2021-10-05 09:09:53,Save meeting id without scheduling,Is there a way to save a meeting id without having to schedule the meeting? It seems like productivity software would make something like this easy but I can't find a way to just save an ID,1.0,1.0,1.0,2.0,/r/Zoom/comments/q1k0hn/save_meeting_id_without_scheduling/,PeaceMarine
2021-10-05 10:32:18,Audio keeps cutting out,[removed],1.0,1.0,1.0,2.0,/r/Zoom/comments/q1lh5f/audio_keeps_cutting_out/,Drago03789
2021-10-05 13:04:05,"Unstable Internet Connection, Even Though My Internet Speeds are High.","I’m having internet connectivity issues just on zoom. When in a call, about every 5 or 10 minutes, everything freezes, audio cuts out, and I get and “internet connection is unstable” error on zoom. I’m on a wired connection, everything is updated, I bought a new router and modem, based on internet speed tests I’m getting 400 mb/s during calls. Anyone have any ideas on what it could be?",1.0,1.0,1.0,6.0,/r/Zoom/comments/q1nwa0/unstable_internet_connection_even_though_my/,Tbones1427
2021-10-05 14:10:00,Will I Recover an Expired Cloud Recording if i renew?,"I had a couple of cloud recordings. When I go to the link now, I get the following error: 

""You cannot view this recording. Cloud Recording plan expired"". I was wondering, if I renew my subscription would these come back or if they are permanently lost?

Thanks",1.0,1.0,1.0,5.0,/r/Zoom/comments/q1orxa/will_i_recover_an_expired_cloud_recording_if_i/,consultant2b
2021-10-05 14:54:24,Best dynamic mic to use from a distance?,[removed],1.0,1.0,1.0,2.0,/r/Zoom/comments/q1pcq4/best_dynamic_mic_to_use_from_a_distance/,pbs037
2021-10-05 19:30:43,No audio in the web version (Linux),"* OS: Manjaro-sway
* Browser: Firefox and Chrome

On my audio panel (pavucontrol) the microphone gets audio.

[https://x0.at/uqag.png](https://x0.at/uqag.png)

I accept the permissions on Firefox and Zoom lists the microphone name fine.

[https://x0.at/aV83.png](https://x0.at/aV83.png)

But it doesn't work. Every other web work with my microphone except Zoom.

Any idea why?",1.0,1.0,1.0,2.0,/r/Zoom/comments/q1uh3f/no_audio_in_the_web_version_linux/,Zeioth
2021-10-05 22:58:26,Audio problems,[removed],1.0,1.0,1.0,0.0,/r/Zoom/comments/q1y11m/audio_problems/,alonoak
2021-10-05 23:46:49,Zoom interpretation audio trouble,[removed],1.0,1.0,1.0,2.0,/r/Zoom/comments/q1z6d5/zoom_interpretation_audio_trouble/,RaiBp
2021-10-06 00:16:31,External audio stop working during a meeting,"Hello, when I enter a meeting, whatever that I was listening in my browser becomes silent. the video keeps going, but I can't hear anything. This is a problem because I like to have my own background music on Youtube while I go to online classes.

I've been looking for a solution to this problem for a long time, so if you can help me it would be awesome.

For extra info: I searched the whole configuration in zoom like five times and nothing; I don't want to share the music that I'm listening; and I hear the audio of the meeting perfectly, even the videos. I use Google Chrome and Youtube most of the times for my background music.

Edit: the problem was that my audio configuration was set in ""allow applications the exclusive control of this device"". If you are having the same problem, go to your audio device settings and check that out.",1.0,2.0,1.0,2.0,/r/Zoom/comments/q1zsz7/external_audio_stop_working_during_a_meeting/,Sinsue7
2021-10-06 01:22:10,"Can participants (not hosts) block other participants' audio, video and chat from a call?",[removed],1.0,1.0,1.0,2.0,/r/Zoom/comments/q2153g/can_participants_not_hosts_block_other/,BlueRottweiler
2021-10-06 01:54:53,Minimizing zoom without having it pinned to the screen,Is there any way to just minimize it so it's out of the way.,1.0,2.0,0.76,6.0,/r/Zoom/comments/q21srw/minimizing_zoom_without_having_it_pinned_to_the/,CommyO
2021-10-06 09:16:52,"Microphone has completely stopped working on Zoom, have tried almost everything imaginable to turn it back on and it won't work. Where to go from here?",NA,1.0,1.0,1.0,2.0,/r/Zoom/comments/q2a3xg/microphone_has_completely_stopped_working_on_zoom/,[deleted]
2021-10-06 10:42:42,Can't join breakout rooms?,[removed],1.0,1.0,1.0,2.0,/r/Zoom/comments/q2bft8/cant_join_breakout_rooms/,Lurkers_of_Reddit
2021-10-06 12:57:00,dis,"&amp;#x200B;

https://preview.redd.it/wm7f0m4chrr71.png?width=327&amp;format=png&amp;auto=webp&amp;s=2a67a2d3090d52a1f3627218aad14653ee4c9fd3",1.0,0.0,0.33,2.0,/r/Zoom/comments/q2dgje/dis/,Carno_Gaming
2021-10-06 16:12:11,"Zoom doubles my voice when used with external mic, work fine with internal",[removed],1.0,1.0,1.0,2.0,/r/Zoom/comments/q2g04n/zoom_doubles_my_voice_when_used_with_external_mic/,Wackalooon
2021-10-06 17:59:44,Zoom Breakout Bug,[removed],1.0,1.0,1.0,2.0,/r/Zoom/comments/q2h9e0/zoom_breakout_bug/,SpaceballsTh3User
2021-10-06 18:39:54,Camera Problem,[removed],1.0,1.0,1.0,2.0,/r/Zoom/comments/q2hs1s/camera_problem/,Foxtride
2021-10-06 18:40:07,Is there any way to install zoom on a different folder?,[removed],1.0,1.0,1.0,2.0,/r/Zoom/comments/q2hs5x/is_there_any_way_to_install_zoom_on_a_different/,WilliamBlueShirts
2021-10-06 19:07:42,"I cant sit still during a Zoom meeting, How to look at myself?",[removed],1.0,1.0,1.0,2.0,/r/Zoom/comments/q2i6bu/i_cant_sit_still_during_a_zoom_meeting_how_to/,GerritTheBerrit
2021-10-06 22:16:33,Meeting quality only suffers when audio and video is turned off. Network is not the issue.,"I have a PC that is an Intel i7, 16GB of memory. I get 93Mbps upload and 70Mbps download with a wired ethernet connection to the router. However when in a Zoom meeting I turn both my video off and I am muted, I get the message that ""my bandwidth is low"" or ""you internet connection is unstable"" or ""poor internet connection maybe affecting your meeting experience"".

My internet connection is clearly not the issue. I've tried uninstalling and reinstalling Zoom, I've installed the 64bit version and nothing has fixed the issue. On my laptop which is older and connected wirelessly, Zoom works with no issues!!!

Any ideas and suggestions would be most welcome. This has been very frustrating.  I've submitted reports to Zoom but heard of nothing back.",1.0,3.0,1.0,4.0,/r/Zoom/comments/q2ldcf/meeting_quality_only_suffers_when_audio_and_video/,jeffjkeys
2021-10-06 22:19:34,System mic/speakers not working,"So my system mic and speakers don’t work ONLY ON ZOOM. They work on every other application.

1. I have checked that I am not muted
2.I have checked that they are enabled across all my settings
3. I have up to date drivers
4. When I connect Bluetooth headphones everything works
5. Everything works fine on other devices

For context I am on windows 10. What is wrong with my zoom? It was working yesterday and today it does not. When I join a call the Audio works for about 2 seconds before instantly cutting out and not working.",1.0,1.0,1.0,7.0,/r/Zoom/comments/q2lfi7/system_micspeakers_not_working/,Affectionate-Sir3336
2021-10-07 02:16:30,"Full name showing in chat, not profile name",[removed],1.0,1.0,1.0,2.0,/r/Zoom/comments/q2q63g/full_name_showing_in_chat_not_profile_name/,mcmcmc58
2021-10-07 02:51:03,"Participants calling by phone, get stuck when transferring into breakout rooms.","Has anyone else heard of or experienced an issue when participants who connect to meetings via phone/toll-free line, are moved into a breakout room.... they sometimes get stuck and are in limbo? 

They are not in the main lobby nor breakout room. They will show in the breakout room panel, as connecting to the breakout room, but never fully connect.",1.0,1.0,1.0,4.0,/r/Zoom/comments/q2qugk/participants_calling_by_phone_get_stuck_when/,skinnnymike
2021-10-07 03:00:07,"Does ""You are connected to Zoom Global Network via data centers in India"" mean the other participant was likely in India?",[removed],1.0,1.0,1.0,2.0,/r/Zoom/comments/q2r0zk/does_you_are_connected_to_zoom_global_network_via/,jb88373
2021-10-07 04:00:33,Zoom program freezes when I start a meeting,[removed],1.0,1.0,1.0,2.0,/r/Zoom/comments/q2s8il/zoom_program_freezes_when_i_start_a_meeting/,FantasiaWHT
2021-10-07 06:10:56,Passcode embedded yet still required to type/paste,"I have scoured the sub for this and I got Zoom and Google calendar sort of communicating both ways thanks to your great help. Still stuck on one detail. I have a link with embedded passcode that I am not hosting. I started by pasting this link into the Notes section of the Calendar entry, but when I clicked it, it asked for the passcode. When I enter the passcode it puts me in the meeting (alone since it starts tomorrow). I thought having Zoom look at my calendar to grab it and then re-add the event back into Google Calendar would maybe help, but it made a whole new link that didn't have the same meeting ID or passcode string. I tried editing this in browser Zoom and it then added the right passcode to the calendar in the section that follows the link in Notes, but the URL is still wrong and I still have to paste the passcode to join. So basically that was worse.

It would be nice to be able to see my scheduled unhosted meetings in my zoom app. But I really just want to be able to click a link and not have to track down the passcode. Bonus would be having Google or Zoom figure out the time zone difference from the meeting ID data so I can't screw that up. At this point it seems like fewest steps to: 1Figure time difference myself, 2 add to Google Calendar with link pasted into event Notes 3 Copy and paste passcode from same source into Notes 4 Set notification 5 Get into Calendar at meeting time and copy passcode 6 Click link 7 Paste passcode when prompted

I feel like there should be a more streamlined way to make this happen that I am missing.",1.0,1.0,1.0,2.0,/r/Zoom/comments/q2usge/passcode_embedded_yet_still_required_to_typepaste/,chiquitar
2021-10-07 06:12:31,"Helping with a wedding, need some guidance",[removed],1.0,1.0,1.0,2.0,/r/Zoom/comments/q2utlt/helping_with_a_wedding_need_some_guidance/,skatman6969
2021-10-07 07:26:28,How do I mute zoom without muting my actual headset? Windows 10,[removed],1.0,1.0,1.0,2.0,/r/Zoom/comments/q2w65g/how_do_i_mute_zoom_without_muting_my_actual/,BDSMFancyFeast
2021-10-07 11:24:54,Profile Picture,[removed],1.0,1.0,1.0,2.0,/r/Zoom/comments/q3080d/profile_picture/,Party_Wolverine_6595
