date,title,selftext,is_self,upvotes,upvote_ratio,n_comments,permalink,author
2021-07-15 02:56:35,This happened - Muted mic icon showing but can still hear,"As the title says, 2 speakers were spotlighted and both had muted mic icons but everyone could still hear them. Changed back to main speaker, muted mic icon still showing for the 2 previous speakers and could still hear them.

Any ideas?",1.0,1.0,1.0,3.0,/r/Zoom/comments/okb135/this_happened_muted_mic_icon_showing_but_can/,odellandy
2021-07-15 03:06:52,"Is there a way to auto generate an attendance file after a meeting? Have a client who wants to. I don’t think there is, but I figured I’d ask.",[removed],1.0,1.0,1.0,2.0,/r/Zoom/comments/okb8qm/is_there_a_way_to_auto_generate_an_attendance/,MuxedoXenosaga
2021-07-15 03:45:48,"When opening Zoom or joining a meeting, the resolution of my monitor changes to 640x480","When opening Zoom or joining a meeting, the resolution of my monitor changes to 640x480.

&amp;#x200B;

How do I fix this?",1.0,1.0,1.0,3.0,/r/Zoom/comments/okc11b/when_opening_zoom_or_joining_a_meeting_the/,jo3ygambin0
2021-07-15 04:57:38,Am I screwed?,[removed],1.0,1.0,1.0,2.0,/r/Zoom/comments/okdiey/am_i_screwed/,Kennisgoodman
2021-07-15 05:39:55,"Zoom Audio won't work, but works on other programs.","Like the title says, Audio will not connect to Zoom, but will work with teams and other programs like teams, skype, go to meeting, etc. 

The computer is a Dell Inc. Latitude 7410, Windows 10.

Things I have tried.

\- Updating drivers

\- Uninstalling and re-installing Zoom

\- Checking privacy settings and sound settings. 

&amp;#x200B;

Wondering if there is any out of the norm fixes someone has had for this. I'm pulling my hair out.",1.0,1.0,1.0,10.0,/r/Zoom/comments/okecu5/zoom_audio_wont_work_but_works_on_other_programs/,boviatt
2021-07-15 07:08:18,How to record webinar with both Gallery view and the two individual speakers full screen?,[removed],1.0,1.0,1.0,2.0,/r/Zoom/comments/okg2pf/how_to_record_webinar_with_both_gallery_view_and/,Tim-Wilson
2021-07-15 11:19:23,Recording messed up (bits of active speaker and then gallery view). Can I retrieve just gallery view for the whole video?,"I recorded 30 minutes of video (interview). First few minutes are in active speaker mode. Then switches to gallery view for the rest of the recording.

&amp;#x200B;

I selected all these options in settings: 

1. Record active speaker with shared screenRecord gallery view with shared screen 

2. Record active speaker, gallery view and shared screen separately

* Active speaker
* Gallery view
* Shared screen

3. Record an audio only file

4. Save chat messages from the meeting / webinar

&amp;#x200B;

I thought I would get x2 mp4 files (one with active speaker and one with gallery view) but it seems I just got one recording. 

&amp;#x200B;

Any ideas how I can edit my video into being all Gallery View? Thanks.",1.0,1.0,1.0,9.0,/r/Zoom/comments/okkafp/recording_messed_up_bits_of_active_speaker_and/,astralcarsonmars
2021-07-15 11:56:58,Unstable connection issues,[removed],1.0,1.0,1.0,0.0,/r/Zoom/comments/okkv74/unstable_connection_issues/,meep_42
2021-07-15 14:53:23,Zoom Screen Sharing,[removed],1.0,1.0,1.0,2.0,/r/Zoom/comments/oknd78/zoom_screen_sharing/,CaptainCerealJuice
2021-07-15 15:07:46,Found this in my class poll,,0.0,1.0,1.0,3.0,/r/Zoom/comments/oknk1l/found_this_in_my_class_poll/,SanjayMaheswaran
2021-07-15 15:12:29,"Episode 26 Summer Dayz - The Funded Project- Car Show, Vendors , Video Game Tournament",,0.0,1.0,1.0,2.0,/r/Zoom/comments/oknm8l/episode_26_summer_dayz_the_funded_project_car/,Tasty-Depth-4067
2021-07-15 16:09:26,😈,,0.0,1.0,1.0,3.0,/r/Zoom/comments/okod92/_/,Normal_Ad_1131
2021-07-15 17:54:23,Content of Self-care,,0.0,1.0,1.0,2.0,/r/Zoom/comments/okpnt3/content_of_selfcare/,Starlight-786
2021-07-15 20:01:00,Zoom getting stuck on connecting,"So my zoom is getting stuck on connecting even with 20 mbps net, disabled firewall and anti virus please help.PLease hellpppp",1.0,1.0,1.0,2.0,/r/Zoom/comments/okre69/zoom_getting_stuck_on_connecting/,Lit_Dhruv_6449
2021-07-15 22:24:44,Use previous free PMI into my corporate account,"Hi all. I'm having a kind of difficulty in understanding how can I make that my new zoom account (a corporate account - SSO login) can be linked to my old account (basic account)?. I want that during my meetings using new PMI (as host), if previous clients wants to join the meeting using old PMI they can be redirected and join. Not sure if something like that can be possible in Zoom. Thanks all for your advice.",1.0,1.0,1.0,6.0,/r/Zoom/comments/oktwac/use_previous_free_pmi_into_my_corporate_account/,dfajardoc
2021-07-16 00:29:50,How bad will zoom be (no video but sharing screen) if I use it on a plane?,[removed],1.0,1.0,1.0,2.0,/r/Zoom/comments/okwe3z/how_bad_will_zoom_be_no_video_but_sharing_screen/,NotVector
2021-07-16 00:46:16,Automation workflows to make Zoom meetings productive,"We all are on Zoom several times a day and honestly, look for ways to make it better. I personally improved a lot as a host/listener — as I tend to learn from others and try out different things. Not every tip works great but leveraging automation seems really interesting.  

If you're interested in trying out new tools, Grain + Zapier workflows seems to make our job way easier - [https://grain.co/blog/make-your-zoom-meetings-productive](https://grain.co/blog/make-your-zoom-meetings-productive). Have you used any automation workflows? Or perhaps, share your best Zoom tip that can help to get the most out of meetings....?",1.0,1.0,1.0,2.0,/r/Zoom/comments/okwq99/automation_workflows_to_make_zoom_meetings/,Rasheed_Ahamed
2021-07-16 01:37:05,A voice says 'muted' and 'unmuted' whenever I hit the mute button. Is there a way to change this?,"I have looked all over online and in the Zoom app itself, but I can't figure out how to stop it. It's super annoying while working.",1.0,1.0,1.0,7.0,/r/Zoom/comments/okxrc7/a_voice_says_muted_and_unmuted_whenever_i_hit_the/,gus_m1
2021-07-16 03:27:16,Question about sharing screens for a remote church service,"Hi all,

I'm relatively new to Zoom and have recently had the responsibility of recording and streaming Zoom from the Church with only the priest and altar party there. The person in charge is really big on having the bulletin be readable as well as sharing the video screen. My question is would there be a way to share the bulletin to the screen but also have the original video of the church in a way that doesn't make the screen small.

Sorry in advance I am new to this and still trying to figure out new terms. Thank you!",1.0,1.0,1.0,6.0,/r/Zoom/comments/okzzxg/question_about_sharing_screens_for_a_remote/,poetry_sloot69
2021-07-16 05:13:15,How to Zoom record only one person's video (but audio for everyone)?,[removed],1.0,1.0,1.0,2.0,/r/Zoom/comments/ol23m7/how_to_zoom_record_only_one_persons_video_but/,EdgarAllenFro
2021-07-16 06:45:21,Audio randomly cuts out during meetings on iPad Pro (possibly related to magic keyboard?),"Hi all, I've got an issue that's been wrecking my schoolwork for the past couple of weeks. All of my lectures are in Zoom, which I use on my iPad Pro (2019 or 2020 I think). I usually keep the tablet docked in the magic keyboard attachment, but I often detach it so I can take notes with the pencil.

Recently, I've begun having an issue in which the Zoom audio just cuts completely out for me after doing this. It's always some random amount of time afterwards; could be ten seconds, or ten minutes. I can open up other apps and the audio is clear as day. Usually the only way I can find to fix it is to hang up and reconnect to the call, and sometimes that doesn't even work right away.

Any clue what could possibly cause this? I can't find anything online and it's not really like any tech issues I've ever troubleshooted before.",1.0,1.0,1.0,5.0,/r/Zoom/comments/ol3tr9/audio_randomly_cuts_out_during_meetings_on_ipad/,apolemian
2021-07-16 07:41:03,Zoom is blocking audio from everything else.,"So, for my music lesson, I need a metronome. I am pretty new to music so I really need this. I use Zoom for my music lesson but Zoom blocks the audio from my metronome. Is there any way to fix this? I just use my normal computer audio if that helps.",1.0,1.0,1.0,4.0,/r/Zoom/comments/ol4t6c/zoom_is_blocking_audio_from_everything_else/,WarfstacheAutomated
2021-07-16 08:00:27,Help,"So I'm planning a meeting for next week, and I need to know if Zoom will time me out if i am only meeting with one person. (I am on basic plan)

&amp;#x200B;

I tried looking it up but there's mixed answers on the internet about this. I've seen some people say there is no time limit if its under three people, then some people say there is a time limit even if there's under three people. 

&amp;#x200B;

Thanks in advance!",1.0,1.0,1.0,8.0,/r/Zoom/comments/ol55au/help/,BlueFlower673
2021-07-16 11:18:54,How to show presenter's face within slides on shared screen?,"Like Teams? 

https://preview.redd.it/o7qpz0h4thb71.png?width=1668&amp;format=png&amp;auto=webp&amp;s=c913267b06427268edf1272dc41875a23c23de24",1.0,1.0,1.0,4.0,/r/Zoom/comments/ol8g1z/how_to_show_presenters_face_within_slides_on/,milkygirl21
2021-07-16 17:07:01,Multiple meetings - how to schedule help?,"I have 6 meetings to schedule during a 5 day window. The meetings are at different times and days. E.e Monday at 9am and 5pm, Tuesday at 6am. 

The meeting template (already created) is the same for each meeting and includes polls etc. 

Is there a way I can create one link to send to all participants ? They just need to turn up at the right time so to speak.",1.0,1.0,1.0,5.0,/r/Zoom/comments/old5j9/multiple_meetings_how_to_schedule_help/,Yawinsome
2021-07-16 19:06:01,"Episode 26 Summer Dayz - The Funded Project- Car Show, Vendors , Video Game Tournament",,0.0,1.0,1.0,2.0,/r/Zoom/comments/oleo6u/episode_26_summer_dayz_the_funded_project_car/,RemarkableElk4235
2021-07-16 20:35:59,"July 18th, Zoom will allow us to turn off recording audio prompt","FYI for account owners, this is only for the audio portion of the prompt, the dialog box will still be there...  


* **Change to recording audio prompt notifications for meeting participants**  
Account owners and admins for all account types can choose who hears the recording notification audio prompt for meeting participants who join via a Zoom client: All participants, Guests only, or **No one**. Previously, you could only choose between All participants or Guests only.",1.0,1.0,1.0,4.0,/r/Zoom/comments/olg041/july_18th_zoom_will_allow_us_to_turn_off/,talones
2021-07-16 20:51:05,How to DISAPPEAR on Camera on ZOOM (Going Invisible),,0.0,1.0,1.0,2.0,/r/Zoom/comments/olg8x8/how_to_disappear_on_camera_on_zoom_going_invisible/,CraftyHuntress
2021-07-16 20:54:54,How to DISAPPEAR on Camera on ZOOM (Going Invisible),,0.0,1.0,1.0,2.0,/r/Zoom/comments/olgb5b/how_to_disappear_on_camera_on_zoom_going_invisible/,CraftyHuntress
2021-07-16 21:00:00,Integrate my app in zoom,"Hello there everone, i have a requirement to integrate my application into zoom like zapps. Can anyone from zoom support let me know I can achieve this. Below is the image link, i am uploading like how i wanted to do.

[https://zoom.us/docs/ent/zapps/assets/img/hero-banner2.png](https://zoom.us/docs/ent/zapps/assets/img/hero-banner2.png)

&amp;#x200B;

Thanks",1.0,1.0,1.0,5.0,/r/Zoom/comments/olge1y/integrate_my_app_in_zoom/,mquanit
2021-07-16 23:44:23,A teenager doesnt want to show up in his meeting.,Will zoom loop my 10 seconds video as the virtual back round or I have to use a entire 40 minutes video as the virtual back ground for a full 40 minutes meeting?,1.0,1.0,0.99,4.0,/r/Zoom/comments/oljgd1/a_teenager_doesnt_want_to_show_up_in_his_meeting/,CMTowF
2021-07-17 01:42:55,Screen Sharing help,"How can I only screenshare 1 tab? Not a window, not an application, just one tab. I'm teaching a lesson and i have the presentation on one tab, and some speaker notes on another, and i only want the students to be able to see the presentation slide.  


Thanks.",1.0,1.0,1.0,3.0,/r/Zoom/comments/ollwz4/screen_sharing_help/,ZBrawlsYT
2021-07-17 02:40:14,(Urgent !! )How to make myself inaudible when my mic is still on so that I can convince teacher that my mic is not working,[removed],1.0,1.0,1.0,2.0,/r/Zoom/comments/oln480/urgent_how_to_make_myself_inaudible_when_my_mic/,LonelyLucifer66
2021-07-17 03:32:09,Join our Cloud HD Video Meeting,[removed],1.0,1.0,1.0,0.0,/r/Zoom/comments/olo757/join_our_cloud_hd_video_meeting/,joinzoomlol
2021-07-17 05:52:47,How to navigate a zoom interview,"A little re-enactment of how you might get through a zoom-based interview:

[https://www.youtube.com/watch?v=gtA6nq7KIRI&amp;t=21s](https://www.youtube.com/watch?v=gtA6nq7KIRI&amp;t=21s)",1.0,1.0,1.0,2.0,/r/Zoom/comments/olqxkv/how_to_navigate_a_zoom_interview/,Noeleonoel
2021-07-17 10:57:27,Help my computer crash and doesn’t want to work any more after it lagged with zoom.,My laptop is now currently restarting and doesn’t want to work and open. It’s stuck at that company sign. I was attending an important seminar and this is frustrating. I’m on my phone now and ongoing meeting but my laptop is going crazy. I’m waiting for my bro in quarantine for a new laptop but this laptop has some games I haven’t backed up but the important files has been updated.,1.0,1.0,1.0,2.0,/r/Zoom/comments/olw15i/help_my_computer_crash_and_doesnt_want_to_work/,Shiwonasemutares
2021-07-17 12:45:34,I cannot join a zoom meeting,"The zoom is stuck on joining, even though I am not in any zoom meeting.  I want to join a meeting, but I can't.

[Help!](https://preview.redd.it/2m6by4fgdpb71.png?width=1320&amp;format=png&amp;auto=webp&amp;s=a0d4178eaac807ac2e22786afa87d53485726447)",1.0,1.0,1.0,8.0,/r/Zoom/comments/olxm6s/i_cannot_join_a_zoom_meeting/,Fickle-Cucumber
2021-07-17 14:33:45,Bluetooth Headphones Audio issue on Zoom,[removed],1.0,1.0,1.0,2.0,/r/Zoom/comments/olz14a/bluetooth_headphones_audio_issue_on_zoom/,rayjaywolf
2021-07-17 18:15:20,What,,0.0,1.0,1.0,2.0,/r/Zoom/comments/om1l6i/what/,a_Post_on_Reddit
2021-07-17 19:35:47,[VIDEO] NDI with Zoom tips,,0.0,1.0,1.0,2.0,/r/Zoom/comments/om2jvb/video_ndi_with_zoom_tips/,kai
2021-07-18 00:20:53,"How do I disable poll pop ups, its intrusive Question",[removed],1.0,1.0,1.0,2.0,/r/Zoom/comments/om7d2n/how_do_i_disable_poll_pop_ups_its_intrusive/,SoyuzRocket
2021-07-18 01:04:07,How to DISAPPEAR on Camera on ZOOM (Going Invisible Trick),,0.0,1.0,1.0,2.0,/r/Zoom/comments/om874d/how_to_disappear_on_camera_on_zoom_going/,FunkyMonkey1360
2021-07-18 01:06:50,How to DISAPPEAR on Camera on ZOOM (Going Invisible Trick),,0.0,1.0,1.0,2.0,/r/Zoom/comments/om891k/how_to_disappear_on_camera_on_zoom_going/,No-Energy2718
2021-07-18 05:04:42,Need team building activities for next zoom meeting,[removed],1.0,1.0,1.0,2.0,/r/Zoom/comments/omcqlu/need_team_building_activities_for_next_zoom/,Sea-Set1072
2021-07-18 05:24:47,Zoom crash dump files gobbling disk space,"Today I called parents on Zoom and they complained about low disk space on Windows. I thought it was the normal ""Windows disk tax"" that would be eliminated by cleaning restored points etc, but then I started to dig deeper and to my utter bewilderment realized that it was Zoom under AppData/Roaming/Zoom/logs that consumed 15 GB (!) just in the last few days, with crash dump files each consuming 1.5 GB. This is to warn others and hopefully devs that this is a problem that needs fixing! This is not normal and shouldn't be this way!",1.0,1.0,1.0,12.0,/r/Zoom/comments/omd3lt/zoom_crash_dump_files_gobbling_disk_space/,ChangeIsHard_
2021-07-18 07:36:29,Trouble with Zoom Account,"So, I've been doing a tabletop gaming group with my friends recently and the first coulpe meetings we  were able to play for a few hours with no limit. I have an account through my school, but didn't know what plan I had. During our last session we had a 40 minute time limit and got cut off. I went to check what my account said and it said I had basic, which is fine, but why was I able to play for longer before? I also tried to see if I could buy the package with longer time and it said that I already had a paid account? So, I'm in a bit of a conundrum, and zoom makes their support really difficult to navigate. Any help would be appreciated!",1.0,1.0,1.0,4.0,/r/Zoom/comments/omf99t/trouble_with_zoom_account/,gilchrist7071
2021-07-18 10:19:29,"My zoom says my internet is unstable and my bandwidth is low even though I am using ethernet. And the thing is that when an internet unstable sign pops up, people are unable to hear me, while I am able to hear everyone else perfectly. I am confused, Plz help with my. Thank you",[removed],1.0,1.0,1.0,2.0,/r/Zoom/comments/omhq2o/my_zoom_says_my_internet_is_unstable_and_my/,HenryH168
2021-07-18 15:12:01,Why does it say I'm not allowed to change avatar?,,0.0,1.0,1.0,83.0,/r/Zoom/comments/omlpgj/why_does_it_say_im_not_allowed_to_change_avatar/,Hodat2k9
2021-07-18 17:56:07,How to DISAPPEAR on Camera on ZOOM (Going Invisible Trick),,0.0,1.0,1.0,3.0,/r/Zoom/comments/omnnnh/how_to_disappear_on_camera_on_zoom_going/,CraftyHuntress
2021-07-18 19:34:32,How to disable background noise removal?,[removed],1.0,1.0,1.0,2.0,/r/Zoom/comments/omovg1/how_to_disable_background_noise_removal/,rhoakla
2021-07-18 22:21:53,Windows app or web,"Hello guys tomorrow will be the first time using zoom, i have the link, but i'll need to download the app or i can just use the link via web? Will i need to register first?",1.0,1.0,1.0,2.0,/r/Zoom/comments/omrffs/windows_app_or_web/,PhOobOs
2021-07-18 23:29:28,Is there a way to hide my webcam to others?,"I really hate doing videocalls and such, and i have anxiety.

Is there a way to hide my webcam to others partecipants but not to the host/professor?",1.0,1.0,1.0,12.0,/r/Zoom/comments/omsoo6/is_there_a_way_to_hide_my_webcam_to_others/,PhOobOs
2021-07-19 00:35:53,tagged,does the  user i  tagged ''notify me when available'' get notified that you are doing that?,1.0,1.0,1.0,3.0,/r/Zoom/comments/omu0s0/tagged/,ben1002000
2021-07-19 00:43:54,"I was trying to record a zoom that I was hosting as a test using Quicktime player screen recording, but my computer restarts each time. Does anyone know why this happens?","I'm just curious as to why it restarts my computer each time (Mac) and why it might not work, like if it's a security thing. Thanks!",1.0,1.0,1.0,2.0,/r/Zoom/comments/omu6qz/i_was_trying_to_record_a_zoom_that_i_was_hosting/,angelaayy
2021-07-19 01:12:08,Zoom recordings of Church Service very Fuzzy,"Hi all,

I'll keep my post short. I've been doing Zoom for a church recently and whenever I upload a service to Youtube the quality is always super bad. I definitely want to fix this before next week. I put the link to the last service on here.

Thank you!

[https://www.youtube.com/watch?v=Ol1q9OdkGjo](https://www.youtube.com/watch?v=Ol1q9OdkGjo)",1.0,1.0,1.0,5.0,/r/Zoom/comments/omurnk/zoom_recordings_of_church_service_very_fuzzy/,poetry_sloot69
2021-07-19 01:20:54,"On one of my computers, video resolution drops when multiple users are pinned - thoughts?","I have two computers, and at times, two people's videos are pinned side by side. When that happens, on ONE of my computers, the two pinned videos' get very blocky and low res. This doesn't happen with the other computer (even at the same time, if I'm using both) The computer speed tests very high even during the meeting, and it's wired, not wireless.

Is there a setting or something I can fix to avoid this?",1.0,1.0,1.0,9.0,/r/Zoom/comments/omuy2j/on_one_of_my_computers_video_resolution_drops/,TheHYPO
2021-07-19 02:04:29,https://t.me/joinchat/2NPBkk3WPdJjOTY0,,0.0,1.0,1.0,3.0,/r/Zoom/comments/omvtaz/httpstmejoinchat2npbkk3wpdjjoty0/,Ancient_Diamond_3100
2021-07-19 02:16:37,Help needed with music lesson playing simultaneously,"I am trying to play music (I'm using a Surface computer) on my bass with my music teacher.  When we try to play together, either I can't hear him or he can't hear me.  I think something is wrong with the settings maybe?

Can someone tell me what the sound settings should be on both ends to best enable playing live music between two participants?

Thank you!",1.0,1.0,1.0,6.0,/r/Zoom/comments/omw24u/help_needed_with_music_lesson_playing/,imastrongwoman
2021-07-19 03:56:07,Watch your invoices...,"In May I had ""Audio Conferencing"" added to my invoice without me doing anything to purchase it at $100 / month.  I contacted support, they reversed the charges and cancelled it.  All good.

But a couple weeks ago it's back.  I used Zoom to do online classes during lockdown, haven't even logged into Zoom  since before this thing got added, yet there it is again, an extra $100 / month getting charged to my card.

I imagine this will once again get reversed... but watch your invoices, apparently there are some billing problems going on.",1.0,1.0,1.0,3.0,/r/Zoom/comments/omy0jk/watch_your_invoices/,CanadianNinja
2021-07-19 08:35:06,Pfp bug??,For some reason i can’t change my pfp anymore on zoom. every time i try changing it  just went to the default pfp and when i close the app it just went back to the previous pfp i used. this never happened to me last time so idk why it is happening now. do anyone know why this is happening?,1.0,1.0,1.0,10.0,/r/Zoom/comments/on34lx/pfp_bug/,FaityWavM
2021-07-19 10:17:24,Zoom to Acquire Five9,,0.0,1.0,1.0,2.0,/r/Zoom/comments/on4spe/zoom_to_acquire_five9/,HotMomentumStocks
2021-07-19 10:42:23,NEW BUG/Cannot change Zoom Profile Pic.,[removed],1.0,1.0,1.0,2.0,/r/Zoom/comments/on56tz/new_bugcannot_change_zoom_profile_pic/,AnimatorNo1810
2021-07-19 11:14:46,ZOOM will acquire Five9 in the form of all stocks with a valuation of approx. $14.7 billion,,0.0,1.0,1.0,2.0,/r/Zoom/comments/on5p5o/zoom_will_acquire_five9_in_the_form_of_all_stocks/,Tough_Philosopher_47
2021-07-19 12:59:05,Mobile Logging but Not Browser and Windows,"For me, Mobile zoom app sign-in is working.
But same username and password in windows and broswer gives ""invalid username or password"" error.

Any idea??",1.0,1.0,1.0,1.0,/r/Zoom/comments/on78j8/mobile_logging_but_not_browser_and_windows/,deathfrost7
2021-07-19 13:49:45,Zoom Purchasing Five9 For $14.7 Billion,,0.0,1.0,1.0,3.0,/r/Zoom/comments/on7xcf/zoom_purchasing_five9_for_147_billion/,NancyLutz
2021-07-19 17:18:45,Can you have a background image in the background of Zoom? Not a virtual background in somebody's video but a background for the black background behind the video boxes?,[removed],1.0,1.0,1.0,2.0,/r/Zoom/comments/onahm4/can_you_have_a_background_image_in_the_background/,GucciMarxist
2021-07-19 19:49:17,Deal: Zoom Buys Cloud Contact Center Firm Five9 For $15B,,0.0,1.0,1.0,6.0,/r/Zoom/comments/onch1n/deal_zoom_buys_cloud_contact_center_firm_five9/,The-Techie
2021-07-19 20:43:10,Sound,I wanted to ask if there's any way I can listen to songs on spotify while attending a zoom meeting? I actually use Bluetooth headphone and attend meeting on my phone. Last year I was able to do it easily. While in meetings I could listen to songs as well as attend the meeting while hearing whatever was the host or other people saying. And only on a single bluetooth headphones. But now whenever I open another media app like YouTube or spotify and play a video or a song then both the sound cuts off. The song or the video are playing but I can't hear anything. And even the sound of members and host in the meeting cannot be heard. Is there anyway to fix this?,1.0,1.0,1.0,2.0,/r/Zoom/comments/ondamr/sound/,TriggerrenGm
2021-07-19 20:50:05,got an important meeting in 10 minutes but I can't change my pfp which is now stuck as an anime avatar,[removed],1.0,1.0,1.0,2.0,/r/Zoom/comments/ondegg/got_an_important_meeting_in_10_minutes_but_i_cant/,UniqueConclusion9118
2021-07-19 22:00:45,no option to add custom filter,i've been trying to add custom filters but the option just does not appear under video filters in the account settings (advanced) is it only a paid for feature? from browsing around it seems it should be available on the basic plan,1.0,1.0,1.0,0.0,/r/Zoom/comments/onemi5/no_option_to_add_custom_filter/,VegetableSoggy3103
2021-07-19 22:04:23,"When sharing my screen or a certain window in during a meeting, others say that the audio doesn't sound right, that it sounds static-y or crackle-y, when on my end it sounds fine.","I tried testing this myself by joining a personal meeting on my laptop and on my phone, and sure enough when listening to the audio on my phone, it sounded static-y, same as what others have said when I shared my screen before.",1.0,1.0,1.0,2.0,/r/Zoom/comments/oneozu/when_sharing_my_screen_or_a_certain_window_in/,LeckoTheGecko
2021-07-19 23:22:33,How do I stop Zoom Chat auto-emoji? [MacOS],"I have a Macbook and I use Zoom extensively for my graduate school. My diagnostic team also uses Zoom instant messaging a lot. We also message professors this way.

Sometimes I add a "":)"" smiley face or some other face to make my messages seem friendlier, but the Zoom Chat keeps auto-correcting it to an emoji. This is specifically for the Zoom instant messaging, not the chat in a video call. How do I stop this? 

It's not my system settings. I turned that all off. I don't see an option to stop this in Zoom preferences. It seems Zoom on MacOS just auto-corrects all faces into emojis. I can't backspace either to turn it back into a regular text face. The moment I type "":)"" or "":D"", it turns into an emoji.",1.0,1.0,1.0,2.0,/r/Zoom/comments/ong7cs/how_do_i_stop_zoom_chat_autoemoji_macos/,americano_ghost
